Title,Time,Comments,Subreddit
sIcK fUcK drOWnS iNnOCenT bIRB,13 hours ,7 ,r/PeopleFuckingDying
Guess I’m not special,1 minute ,0 ,r/memes
2 years on this pile of garbage,2 minutes ,0 ,r/memes
One has to set priorities in life,1 hour ,56 ,r/memes
I hate driving,8 hours ,6 ,r/memes
Despicable me..,20 hours ,4 ,r/memes
California girls,11 hours ,17 ,r/shitposting
Pull them off,18 hours ,3 ,r/memes
am i wrong?,10 hours ,2 ,r/memes
evil go pro be like,11 hours ,2 ,r/memes
POV: There’s an Unsupervised subway,1 hour ,0 ,r/memes
Me when I sign a contract without looking,10 hours ,5 ,r/shitposting
Bad grammar done on purpose to fit the stonks meme variant,4 hours ,7 ,r/memes
Texas 🍺 New York 🍷,17 hours ,9 ,r/memes
"It doesn’t make you a nice person, it’s just more confusing this way. Take your turn",17 hours ,4 ,r/memes
"I, for one, welcome our fried chicken overlords",11 hours ,0 ,r/memes
Bottom Text,6 hours ,5 ,r/shitposting
Guys I’m LGBT I can make this joke,4 hours ,56 ,r/memes
I've seen this before...,21 hours ,2 ,r/memes
That’s is,2 hours ,3 ,r/memes
This is what is supposed to be the destiny,6 hours ,5 ,r/memes
anime_irl,16 hours ,51 ,r/anime_irl
its all fun and games till you actually gotta do something,2 hours ,3 ,r/memes
Yeah so basically… yk?,14 hours ,3 ,r/memes
Big brain moment,2 hours ,9 ,r/memes
💀💀,20 hours ,3 ,r/shitposting
who's next?,1 hour ,1 ,r/memes
Don’t talk to my son,15 hours ,5 ,r/memes
Opinion | You Want an Electric Car With a 300-Mile Range? When Was the Last Time You Drove 300 Miles?,2 hours ,3 ,r/technews
"Following its Series A, Poparazzi’s team is readying a new social app that goes beyond photos",39 minutes ,0 ,r/technews
4 days until friday!,16 hours ,4 ,r/memes
Name your Wish -The Djinn,5 hours ,1 ,r/memes
best candidate,2 hours ,8 ,r/memes
Mushrooms releasing millions of microscopic spores into the wind to propagate.,52 minutes ,33 ,r/blackmagicfuckery
Be careful what you wish for.,7 hours ,0 ,r/memes
Sentence gymnastics.,5 hours ,4 ,r/memes
Dating site stats don’t lie,2 hours ,9 ,r/memes
tripping potato's,17 hours ,4 ,r/memes
Heights of Statues Around the World.,8 hours ,217 ,r/educationalgifs
Tried the new Saints Row...waste of money.,11 hours ,7 ,r/memes
"I'm independent btw, this meme is about a politician but not trying to be political",13 hours ,3 ,r/memes
Insane revisionist history? Or am I just better informed than your dumbass,7 hours ,7 ,r/memes
Half convinced it should be the other way round.,6 hours ,2 ,r/memes
Firefighter's quick reaction to save this woman's child,2 hours ,57 ,r/HumansAreMetal
I will not,3 hours ,1 ,r/memes
"This is what your food eats, Vegans.",20 hours ,2 ,r/memes
Happens very often,7 hours ,2 ,r/memes
☠️😴🤷🏼‍♀️🫦,4 hours ,1 ,r/memes
death,16 hours ,16 ,r/shitposting
when the girl you fantasize about being in a relationship with turns out to be lesbian,6 hours ,4 ,r/memes
Now if you'll excuse me I have to stay awake all night because my anxiety won't let me sleep.,14 hours ,1 ,r/memes
assembly error,15 hours ,1 ,r/memes
Tried and tested vegan cookbook recommendations with tasty recipes (especially sweet and sour) or savory,3 hours ,7 ,r/veganrecipes
My Dad told a really subtle one.,just now,0 ,r/dadjokes
ruined da song,20 hours ,36 ,r/memes
"""Everything you said was wrong""",1 day ,0 ,r/memes
"Cant believe I’ve never thought about this, given that this was always my favorite power up in Mario games",15 hours ,1 ,r/memes
seen that one unfortunately,4 hours ,6 ,r/memes
Honestly an iconic era,16 hours ,8 ,r/shitposting
Then what's the point? I'm hungry...,1 hour ,0 ,r/memes
i really really get it,10 hours ,2 ,r/memes
Wait..! I don’t even have a cat!,22 hours ,8 ,r/memes
12345678901234567890,14 hours ,3 ,r/memes
anime irl,44 minutes ,2 ,r/anime_irl
Seems like the admins alley,13 hours ,40 ,r/memes
Master Chef,4 hours ,3 ,r/memes
What if we've led him astray?,5 hours ,0 ,r/memes
livin life 😎,1 hour ,3 ,r/memes
"FYI, the FBI Warns Your Investment in DeFi Might Go Awry | Federal law enforcement pointed to the growing number of hacks and exploits used to steal billions in crypto from ‘decentralized’ platforms.",1 hour ,0 ,r/technews
gucci gang gucci gang gucci gang gucci gang,16 hours ,40 ,r/memes
original meme by u/imallorganic,4 hours ,6 ,r/memes
So me 💯,8 hours ,4 ,r/memes
have seen Zeus more often than people with this superpower,4 hours ,0 ,r/memes
I'm doing my part,23 hours ,17 ,r/MildlyVandalised
the gameplay is not great tho,9 hours ,29 ,r/memes
Fish fingers,14 hours ,6 ,r/memes
let me post please man please,11 hours ,4 ,r/memes
Does renewable energy actually work? I mean apart from nuclear and hydro and other proven renewables.,7 hours ,11 ,r/answers
[ Removed by Reddit ],2 minutes ,1 ,r/dadjokes
A Suggestion to Reddit HQ,2 minutes ,0 ,r/Jokes
smart move,16 minutes ,0 ,r/memes
Daily Nichijou meme #1599,14 minutes ,0 ,r/memes
Mado one for my european bros,9 hours ,35 ,r/memes
Rainy Nights - Paprika_d,9 hours ,42 ,r/PixelArt
feels like ground hog day,4 hours ,20 ,r/memes
my friends kid had covid a couple months ago. today he coughed a tiny bit. this thought came to mind.,12 hours ,6 ,r/memes
Discussing House of the Dragons at work,6 hours ,2 ,r/memes
me and the boys going to a party,55 minutes ,0 ,r/memes
Lunch is fresh as hell,12 hours ,72 ,r/cats
useless and interesting at the same time,5 hours ,0 ,r/memes
Just flip it 🔄,17 hours ,7 ,r/memes
minion that i spent way too long looking for,4 hours ,1 ,r/memes
illuminaughtii,8 hours ,5 ,r/memes
Woman hid from police by pretending to wash dishes,58 minutes ,1 ,r/ActLikeYouBelong
Meet my 9mm friend...,3 hours ,9 ,r/memes
It be raining everyday,12 hours ,4 ,r/memes
Quantum Physics!,3 hours ,17 ,r/memes
"Just curious, what do you guys see in this photo? (I see a happy meal)",2 hours ,11 ,r/memes
Drawing Jimmy G every day until he gets traded. Day 209:,2 hours ,141 ,r/49ers
Quandale Dingle,13 hours ,1 ,r/memes
the best crashing simulator,11 hours ,4 ,r/memes
My weekend be like,16 hours ,1 ,r/memes
Well behaved service dog at church,6 hours ,86 ,r/dogswithjobs
Electrician is the best job,3 minutes ,0 ,r/dadjokes
I asked the librarian if books about paranoia were available. She looked up and whispered,11 minutes ,0 ,r/dadjokes
As a large man I've never been able to properly wash my back,7 minutes ,0 ,r/Jokes
a great deal was struck,just now,0 ,r/memes
WCGW being a 3 inch puncher?,1 hour ,22 ,r/Whatcouldgowrong
Alcohol,2 minutes ,0 ,r/Jokes
"DON'T give me your free stuff, I'll feel bad",15 minutes ,4 ,r/memes
My friend over there really wants to know your number,5 minutes ,0 ,r/Jokes
Gotta catch em all,8 minutes ,0 ,r/memes
Beekeeper protecting his flock from wasps,2 hours ,112 ,r/oddlysatisfying
Cashin dem hairy ass checks,3 hours ,0 ,r/memes
Today I had the opportunity of meeting one of my heros!,26 minutes ,0 ,r/memes
Worst kind of internal pain,4 hours ,2 ,r/memes
Just gonna leave this right here lol,3 hours ,12 ,r/memes
Funny Grub,7 hours ,51 ,r/HollowKnightMemes
The Mc Donald lady straight up bussing,3 hours ,0 ,r/memes
🦒 Asparagus,7 hours ,8 ,r/memes
*flips through notebook* here’s your name!,6 hours ,2 ,r/memes
What did I do to deserve this punishment?,16 hours ,3 ,r/memes
Sony has cut the PS5's weight after raising its price,17 minutes ,3 ,r/gadgets
I sure do love reading!,2 hours ,0 ,r/memes
"not a cell ohinw in sight, just people living in the moment",12 hours ,2 ,r/memes
Not too personal (for me),4 hours ,3 ,r/memes
WCGW throwing rocks at a boulder,15 hours ,68 ,r/Whatcouldgowrong
"Seriously,they're cancer",21 hours ,17 ,r/memes
non fungible titties,6 hours ,27 ,r/memes
"bloggers are ""creative"" people",17 hours ,2 ,r/memes
He put him in a corner so fast,16 hours ,1 ,r/memes
It's all about point of view,6 hours ,9 ,r/memes
Monster hunter home meals be like.,3 hours ,90 ,r/MemeHunter
You will be independent under my control,12 hours ,3 ,r/memes
it do be like that for most of us.,12 hours ,6 ,r/memes
Pre-Planned procrastination at it's very best!,3 hours ,1 ,r/memes
"in the ""computer room""",28 minutes ,0 ,r/memes
What is the context of this?,1 hour ,0 ,r/KnowYourMeme
Imagine if food actually spawns,6 hours ,1 ,r/memes
Why is this page shutting meme’s down,13 hours ,6 ,r/memes
buzz buzz mufferfugger,13 hours ,4 ,r/memes
God witnessing humans invent sounding,2 hours ,1 ,r/memes
Kitty doing the workout grind,5 hours ,6 ,r/Thisismylifemeow
from experience,9 hours ,14 ,r/memes
It's going to happen to me soon.,6 hours ,7 ,r/memes
Um what?,15 hours ,2 ,r/memes
oh not good,53 minutes ,3 ,r/memes
"what is this meme (i apologize about the bad quality, but i have been looking for forever and i cant find anything)",19 hours ,10 ,r/KnowYourMeme
Meme on Coffee,12 hours ,0 ,r/memes
Mmm Cookies & CrEaM,6 hours ,2 ,r/memes
I'm screwed,18 hours ,4 ,r/memes
"While driving long road trips, do you ever notice a car who's in front of or behind you for hours that you decide is your road trip buddy? Then tell them goodbye once they or you finally take a separate route?",19 hours ,607 ,r/NoStupidQuestions
I hit every target in the slingshot minigame in 32 shots,13 hours ,238 ,r/StardewValley
What do you wear when you want to dress up as the richest man in the world?,7 minutes ,1 ,r/Jokes
good old days,2 minutes ,1 ,r/memes
I love my friends.,5 minutes ,0 ,r/memes
Ooookay time to leave again,19 hours ,1 ,r/memes
"found this on FB, I thought it was really sweet :')",14 hours ,6 ,r/beyondwholesome
why tho,12 minutes ,0 ,r/memes
He's gonna needsome counseling...,6 hours ,7 ,r/memes
Everywhere I look I see his face.,8 hours ,5 ,r/memes
You never know their next move 😏,17 hours ,5 ,r/memes
Fascinating magic trick ✨️ 🎩,5 hours ,23 ,r/SipsTea
The only disgusting thing guys want,1 hour ,6 ,r/memes
Disney: I'll allow man shaming,4 hours ,5 ,r/memes
How else am I gonna save 30 seconds?,17 hours ,38 ,r/memes
Based on true events,4 hours ,15 ,r/memes
anime_irl,2 hours ,4 ,r/anime_irl
Only one remained after the battle.,6 hours ,11 ,r/memes
thank god,4 months ,1.1k ,r/memes
Ukraine got CHAD Volodymyr Zelensky.🇺🇦🇺🇦🇺🇦,6 months ,2.7k ,r/memes
Reddit might be shit but it's our shit.,11 months ,1.5k ,r/memes
Wish her luck boys,2 months ,1.1k ,r/memes
Chrome lite for pc,9 months ,2.0k ,r/memes
I'm convinced the paparazzi are sociopaths,1 year ,3.2k ,r/memes
The Darwin Incident,4 months ,1.5k ,r/memes
How could this have happened?,5 months ,1.2k ,r/memes
shit just went from unlimited power to i'm too weak,4 months ,559 ,r/memes
Is it really that glorious?,7 months ,1.4k ,r/memes
Still waiting,5 months ,543 ,r/memes
I miss Rick Moranis,3 months ,532 ,r/memes
You know it’s a good tutorial when the voice-over sounds tired,10 months ,1.3k ,r/memes
Context: the livestream got taken down yesterday,2 months ,3.3k ,r/memes
Me_irl,8 months ,4.0k ,r/me_irl
He should change his hairstyle,9 months ,2.0k ,r/memes
easy checkmate,3 months ,1.1k ,r/memes
It do be like that,3 months ,901 ,r/memes
and if you choose the wrong option it will give you an extra 30 minutes,3 months ,612 ,r/memes
Gotta go back again,4 months ,877 ,r/memes
"""I'll Never Financially Recover from This, Coral...!""",8 months ,1.0k ,r/memes
WTF is a turn signal?,13 days ,871 ,r/memes
Left behind,24 days ,570 ,r/memes
The King is back on his throne.,19 days ,541 ,r/memes
What a nice wake up...,2 days ,1.9k ,r/memes
me_irl,12 days ,876 ,r/me_irl
Moms being moms.,16 days ,592 ,r/memes
Permanently scarred,21 days ,406 ,r/memes
me_irl,1 month ,1.2k ,r/me_irl
Clearly lacking in fibre,20 days ,1.6k ,r/memes
me_irl,22 days ,514 ,r/me_irl
U seeing this sh*t?,9 days ,723 ,r/memes
Well about that..,14 days ,424 ,r/memes
what? why? and then?,5 days ,2.6k ,r/memes
every time,8 days ,634 ,r/memes
Well that escalated quickly,24 days ,590 ,r/memes
Language settings be like,8 days ,1.5k ,r/memes
Damnit not again,18 days ,312 ,r/memes
She will be so mad,10 days ,274 ,r/memes
Me_irl,1 day ,217 ,r/me_irl
Wait for the cameo at the end,7 days ,1.2k ,r/memes
I am simply built different,7 days ,415 ,r/memes
"Can confirm, it was a helicopter.",9 days ,434 ,r/memes
Universal language,1 day ,309 ,r/memes
me irl,19 days ,175 ,r/me_irl
"No Billy, don't cheer",13 days ,299 ,r/memes
Vegan mom gets life in prison for starvation death of son,2 hours ,1.7k ,r/news
Yeh! You let him know terry.,3 hours ,195 ,r/Unexpected
WCGW letting your intrusive thoughts win and light a dry decor,4 hours ,553 ,r/Whatcouldgowrong
A line of campus bots following me at my college,5 hours ,2.2k ,r/mildlyinteresting
look how cute they are,5 hours ,125 ,r/wholesomememes
Nurse gets arrested for following hospital policy,4 hours ,1.6k ,r/PublicFreakout
Try going a whole day without shooting an innocent person,5 hours ,1.9k ,r/MurderedByWords
Roger Federer keeping a pinky promise,3 hours ,192 ,r/MadeMeSmile
Business:100,5 hours ,395 ,r/meme
Just pure fun :),5 hours ,197 ,r/rarepuppers
Cock'em,5 hours ,174 ,r/HolUp
Til wolverine was created because Marvel's then editor in chief Roy Thomas wanted a Canadian hero to boost north-of-the-border sales,6 hours ,831 ,r/todayilearned
"Nobody Ever Found the Next ‘Hunger Games’ – But Boy, Did They Try",4 hours ,2.3k ,r/movies
"""Ellesse Guy"", Me, Digital, 2022",4 hours ,185 ,r/Art
Nice head massage,5 hours ,139 ,r/aww
Beekeeper protecting his bees from being attacked by hornets,7 hours ,3.9k ,r/nextfuckinglevel
Please write in English,7 hours ,1.2k ,r/facepalm
Blursed visit,5 hours ,59 ,r/blursedimages
‘People are tired of being ignored while the rich get richer’: Bernie Sanders on anger and hope in the US and UK,7 hours ,1.1k ,r/politics
🔥 Vulture Joining a paraglide,7 hours ,469 ,r/NatureIsFuckingLit
"She’s 14, has terminal cancer, and just discovered the fireplace. I think her final months will be the best she’s ever had.",5 hours ,181 ,r/cats
this what heppens when you do democracy,4 hours ,641 ,r/WhitePeopleTwitter
This sign in my Aunts house,5 hours ,1.3k ,r/mildlyinfuriating
Time to install a speed limit sign on the loading dock,4 hours ,417 ,r/IdiotsInCars
meirl,7 hours ,310 ,r/meirl
What is this?,7 hours ,1.1k ,r/interestingasfuck
"Moscow condemns 'Russophobia' in Baltic states, say it will affect ties",8 hours ,1.8k ,r/worldnews
Thank you so much,6 hours ,92 ,r/dankmemes
"""Brothers! help me enslave humanity.""",7 hours ,228 ,r/FunnyAnimals
They’re always watching 😂😂 Solid 10min segment dedicated strictly to explaining themselves for the “Short Covering Cut Off” yesterday 😭😂,7 hours ,800 ,r/Superstonk
me_irl,6 hours ,74 ,r/me_irl
Jesus want no fuck,5 hours ,589 ,r/terriblefacebookmemes
Batman to the rescue,8 hours ,721 ,r/PoliticalHumor
"Republicans are increasingly sharing misinformation, research finds",7 hours ,3.9k ,r/technology
Love Y'all; Keep Going!,6 hours ,48 ,r/WorkReform
Hot take!,6 hours ,112 ,r/antiwork
No chopsticks for dad? Just use a Barbie doll!,8 hours ,495 ,r/funny
I would absolutely read that book,8 hours ,643 ,r/tumblr
To move the waste bin,8 hours ,848 ,r/therewasanattempt
"Slow, sunny mornings at my apartment in Baltimore, MD.",3 hours ,185 ,r/CozyPlaces
So close to getting it...,5 hours ,417 ,r/SelfAwarewolves
"The age of the ‘car is king’ is over. The sooner we accept that, the better",6 hours ,2.5k ,r/Futurology
Heck sounds stressful,7 hours ,424 ,r/oddlyspecific
Clouds,4 hours ,31 ,r/comics
What does that even mean???,4 hours ,395 ,r/Tinder
"Grace Jones and her bodyguard Dolph Lundgren, 1985",8 hours ,810 ,r/OldSchoolCool
"[Adam Cooper] @SchumacherMick will no longer officially be part of the wider @ScuderiaFerrari family in 2023, so he's free to look elsewhere for an F1 drive",6 hours ,1.1k ,r/formula1
Mushrooms releasing millions of microscopic spores into the wind to propagate.,1 hour ,65 ,r/blackmagicfuckery
(OC) The lore is full of lies,7 hours ,199 ,r/pokemon
"Meghan Markle was 'happy' to leave the royal family, get her social media accounts back, claiming her images were instead given to people who were “calling my children the N-word.”",6 hours ,2.0k ,r/entertainment
Twerking on the bus shelter,3 hours ,234 ,r/WinStupidPrizes
Transphobia so strong you start to discriminate against cis people,5 hours ,245 ,r/CuratedTumblr
retractable teeth,6 hours ,66 ,r/BrandNewSentence
Finally caught him after 40 years,6 hours ,41 ,r/memes
"Oh no, anyway",5 hours ,21 ,r/BikiniBottomTwitter
"Jag är Sveriges statsminister, AMA!",4 hours ,2.1k ,r/sweden
"The Netherlands: A guy didn't want to buy train ticket, he hit female train conductor, gave her a bloody nose, another train conductor slam dunks him.",2 hours ,143 ,r/AbruptChaos
Be mindful guys,10 hours ,277 ,r/ukraine
Painting one wind turbine blade can reduce bird fatalities by 72%,3 hours ,159 ,r/UpliftingNews
Ozzy Osbourne says he's leaving the US because of gun violence,3 hours ,495 ,r/nottheonion
"Amateurs, I've come to bargain.",7 hours ,171 ,r/marvelmemes
Beekeeper protecting his flock from wasps,2 hours ,153 ,r/oddlysatisfying
Chillin with the homie Grey Jay,2 hours ,29 ,r/AnimalsBeingBros
"Rosie, Protector of the house. Devourer of burglars.",9 hours ,601 ,r/Bossfight
racim,7 hours ,103 ,r/shitposting
Don’t put them in my mouth then idiot,6 hours ,17 ,r/whenthe
Who cares about most difficult Boss. This enemy is the most annoying in the entire lands between.,4 hours ,406 ,r/Eldenring
"""In this small town, Zhizdra, after the fights, I did not find anyone alive except this wounded cat"" - Eastern Front, 1943 [750x1127]",7 hours ,75 ,r/HistoryPorn
Facebook dating,7 hours ,108 ,r/suspiciouslyspecific
Chad Peter,5 hours ,64 ,r/raimimemes
A simple fact that not many people understand,5 hours ,94 ,r/technicallythetruth
Self feeding fire,5 hours ,184 ,r/redneckengineering
Beekeeper protecting his bees from being attacked by hornets,5 hours ,143 ,r/CrazyFuckingVideos
Accurate. (Own Repost),9 hours ,622 ,r/lotrmemes
The superior developer,8 hours ,153 ,r/ProgrammerHumor
Was traveling on rayanair and this guy kept touching me with his fucking bare feet,4 hours ,368 ,r/trashy
yep lockers are done boss. What do you mean there is a problem?,8 hours ,97 ,r/NotMyJob
Trying to be smooth,4 hours ,386 ,r/sadcringe
Honestly that one is pretty impressive.,6 hours ,26 ,r/NonPoliticalTwitter
Nothing lile calling children crotch goblins.,3 hours ,233 ,r/FuckYouKaren
Younger dogs can actually help older dogs feel youthful again.,6 hours ,25 ,r/tippytaps
me_irl,13 hours ,112 ,r/me_irl
What did the electrician’s boss say when he came late to work?,18 hours ,167 ,r/dadjokes
A blonde woman visits her husband in prison.,6 hours ,147 ,r/Jokes
"In the film The Mummy, the titular Mummy turns other people into mummies.",2 hours ,2 ,r/3amjokes
This is where the fun begins,22 hours ,36 ,r/shitposting
me irl,5 hours ,3 ,r/me_irl
Maybe I am a bot and all this is a simulation,3 hours ,32 ,r/memes
been too long since I've played this game,10 hours ,33 ,r/memes
"I was touched when my ailing grandma said, ""I will always watch over you from above"", before succumbing to her illness.",3 hours ,17 ,r/TwoSentenceHorror
Gotta show some compassion,12 hours ,6 ,r/memes
My mother always said I’m a literal person.,6 hours ,14 ,r/memes
Dogs can’t solve this operation Ryder,11 hours ,78 ,r/memes
MONKEY VS. ROBOT!!,18 hours ,0 ,r/oldinternet
Among us 😳,12 hours ,27 ,r/memes
"A sweater I bought was picking up static electricity. So, I returned it to the store.",7 hours ,48 ,r/dadjokes
Thank you so much,6 hours ,19 ,r/memes
how to deal with anyone,21 hours ,148 ,r/shitposting
Thankfully I won’t have to deal with anxiety anymore !,2 hours ,1 ,r/3amjokes
"Jesus drove a Honda, but never spoke of it.",16 hours ,331 ,r/Jokes
"A sweater I bought was picking up static electricity. So, I returned it to the store.",7 hours ,52 ,r/Jokes
What traits do sheep have that allow them to survive being deep fried?,13 hours ,57 ,r/shittyaskscience
My friend was kidnapped by mimes.,14 hours ,41 ,r/dadjokes
There's too many gun shots,18 hours ,26 ,r/memes
Woman hid from police by pretending to wash dishes,1 hour ,6 ,r/ActLikeYouBelong
My Dad told a really subtle one.,38 minutes ,2 ,r/dadjokes
Dog gone tired of it too.,12 hours ,7 ,r/memes
"Who does Captain Crunch, report to?",19 hours ,96 ,r/dadjokes
All we are saying...,3 hours ,3 ,r/dadjokes
I’ve started putting milk on my bread before I fry it. But my family can’t stand it.,18 hours ,13 ,r/dadjokes
Know one will ever know!,20 hours ,1 ,r/memes
Anime_irl,4 hours ,16 ,r/anime_irl
me_irl,1 day ,32 ,r/me_irl
My constipated friend tested a food dye-based laxative that worked much too well.,3 hours ,3 ,r/dadjokes
Why do dinosaurs make such bad pets?,18 hours ,71 ,r/Jokes
"""Ellesse Guy"", Me, Digital, 2022",4 hours ,187 ,r/Art
me_irl,16 hours ,23 ,r/me_irl
me_irl,2 hours ,0 ,r/me_irl
[ Removed by Reddit ],37 minutes ,9 ,r/dadjokes
"An Englishman, Frenchman and a Soviet go to an art exhibition.",22 hours ,13 ,r/Jokes
me_irl,22 hours ,9 ,r/me_irl
A London lawyer runs a stop sign and gets pulled over by an Irish Garda.,3 hours ,9 ,r/Jokes
me_irl,1 hour ,2 ,r/me_irl
Rian Johnson Still Wants To Make His Star Wars Trilogy: ‘It Would Break My Heart If I Were Finished’,20 minutes ,7 ,r/boxoffice
2 blind men were having a fight,12 hours ,24 ,r/Jokes
Which nationality has the smallest knees?,15 hours ,15 ,r/dadjokes
A Suggestion to Reddit HQ,38 minutes ,7 ,r/Jokes
There’s a fine line between a numerator and a denominator.,21 hours ,35 ,r/dadjokes
Mushrooms releasing millions of microscopic spores into the wind to propagate.,2 hours ,67 ,r/blackmagicfuckery
Nothing happens,19 hours ,91 ,r/antimeme
My inheritance,2 hours ,5 ,r/dadjokes
What's your favorite pickup line?,4 hours ,18 ,r/Jokes
Electrician is the best job,24 minutes ,1 ,r/dadjokes
I taught my kids about democracy tonight by…,23 hours ,11 ,r/dadjokes
My dad is transitioning and says when it's done I won't be able to see him anymore,6 hours ,10 ,r/dadjokes
"Why do we tell actors to ""break a leg""?",20 hours ,2 ,r/dadjokes
burger king,22 hours ,24 ,r/antimeme
"A friend of mine, a performing arts student, was recently killed in an accident in Toronto…",2 hours ,2 ,r/Jokes
I shot an elephant in my pajamas this morning.,2 hours ,5 ,r/dadjokes
me_irl,5 hours ,0 ,r/me_irl
SpongeBob is still good,3 hours ,200 ,r/BikiniBottomTwitter
Which knight invented King Arthur's Round Table?,5 hours ,10 ,r/Jokes
Why don’t they make a pregnant Barbie doll?,4 hours ,8 ,r/Jokes
Why couldn’t the bicycle stand up by itself?,12 hours ,9 ,r/dadjokes
“Did you close the garage? Did you lock the doors? What else could we be forgetting?”….,20 hours ,19 ,r/memes
Get the holy water,3 hours ,0 ,r/memes
swipe left? never heard of her,5 hours ,4 ,r/memes
Heck sounds stressful,7 hours ,426 ,r/oddlyspecific
me_irl,5 hours ,24 ,r/me_irl
Who is that guy Rorschach??,4 hours ,10 ,r/Jokes
RIP boiled water.,4 hours ,2 ,r/dadjokes
Why can’t you live at the end of the universe?,49 minutes ,4 ,r/Jokes
Injera with a variety of Vegan Ethiopian dishes,8 hours ,8 ,r/VeganFoodPorn
"""You've got 24 hours to live""",15 hours ,11 ,r/Jokes
My mother always said I’m a literal person.,7 hours ,14 ,r/memes
"Jesus drove a Honda, but never spoke of it.",17 hours ,331 ,r/Jokes
A Suggestion to Reddit HQ,40 minutes ,7 ,r/Jokes
Why can’t you live at the end of the universe?,50 minutes ,4 ,r/Jokes
Mamwa Paolo throwing shade (Where's the Flowers?),10 hours ,2 ,r/MemeTemplatesOfficial
lets go,23 hours ,500 ,r/memes
mc donald,3 hours ,16 ,r/memes
I’ve wasted my life.,6 hours ,14 ,r/memes
"Nobody Ever Found the Next ‘Hunger Games’ – But Boy, Did They Try",4 hours ,2.4k ,r/movies
Vegan mom gets life in prison for starvation death of son,3 hours ,1.9k ,r/news
Nurse gets arrested for following hospital policy,4 hours ,1.7k ,r/PublicFreakout
This in flight proposal,7 hours ,1.9k ,r/MadeMeSmile
They’re always watching 😂😂 Solid 10min segment dedicated strictly to explaining themselves for the “Short Covering Cut Off” yesterday 😭😂,7 hours ,808 ,r/Superstonk
He did it!,23 hours ,1.1k ,r/MadeMeSmile
An attempt to embarrass a climate change activist backfires,17 hours ,2.9k ,r/WatchPeopleDieInside
This guy waterslides,19 hours ,680 ,r/oddlysatisfying
Amazon is Inhumane,19 hours ,4.1k ,r/antiwork
I fly racing drones for a living and i chased some driftcars this weekend. It looks like a videogame,23 hours ,1.3k ,r/nextfuckinglevel
A random guy sends his vocals to deadmau5 - gets signed immediately and the song became an instant hit,13 hours ,1.5k ,r/Damnthatsinteresting
Jeff Bezos is one Alexa away from using prison labors.,18 hours ,3.8k ,r/mildlyinfuriating
Donnie Dunagan,21 hours ,495 ,r/Damnthatsinteresting
Tourists in Mexico have a tense encounter with a black bear,17 hours ,4.2k ,r/interestingasfuck
Biden vows to crack down on colleges 'jacking up costs' and causing student debt to spiral after Trump 'looked the other way',23 hours ,3.2k ,r/politics
Loving the water.,22 hours ,369 ,r/aww
Looks like a Survey Pilot's last day today,21 hours ,714 ,r/funny
Woman is reunited with her dog that was missing for two weeks,14 hours ,352 ,r/MadeMeSmile
Little Egg Harbor PD (NJ) cops detained a young man in handcuffs because he flipped one of them off. Young man wasn't having any of it!,20 hours ,5.1k ,r/PublicFreakout
Maybe I am a bot and all this is a simulation,4 hours ,34 ,r/memes
me irl,5 hours ,4 ,r/me_irl
A blonde woman visits her husband in prison.,6 hours ,153 ,r/Jokes
been too long since I've played this game,10 hours ,34 ,r/memes
My Dad told a really subtle one.,46 minutes ,3 ,r/dadjokes
Rian Johnson Still Wants To Make His Star Wars Trilogy: ‘It Would Break My Heart If I Were Finished’,27 minutes ,23 ,r/boxoffice
me_irl,7 hours ,75 ,r/me_irl
Anime_irl,4 hours ,17 ,r/anime_irl
