Title,Time,Comments,Subreddit
This is what people say to me,33 minutes ,4 ,r/memes
Dude wtf,16 minutes ,0 ,r/memes
Only some arthropods are ok,6 hours ,35 ,r/memes
the riddler kinda…,14 hours ,1 ,r/memes
Thank you... 😢😮😃,14 minutes ,0 ,r/memes
"It doesn’t make you a nice person, it’s just more confusing this way. Take your turn",20 hours ,4 ,r/memes
Where's the tux?,33 minutes ,0 ,r/memes
I'm screwed,21 hours ,5 ,r/memes
Fact check true,4 hours ,1 ,r/memes
facts...,31 minutes ,0 ,r/memes
Back Pocket vs Front Pocket,56 minutes ,17 ,r/memes
Massive F in the chat for this guy who got friendzoned in front of the entire stadium,7 minutes ,0 ,r/memes
me and the boys going to a party,4 hours ,2 ,r/memes
Get ready fuckers,47 minutes ,5 ,r/memes
"And ""her/majesty"" for the Queen",59 minutes ,2 ,r/memes
Never touch a Police man's car.,45 minutes ,3 ,r/memes
Went to pick up paint when suddenly,2 minutes ,0 ,r/memes
I wasn't.,3 minutes ,0 ,r/memes
Monty Python Reference,6 hours ,5 ,r/memes
I'm sure they can't play...,4 hours ,3 ,r/memes
SAY WAH,23 hours ,8 ,r/shitposting
He knows a thing or two,4 hours ,0 ,r/memes
Thomas the Train Engine sends his regards,1 hour ,15 ,r/memes
"And then I have to suffer through their ""inspirational"" quotes every day.",5 hours ,0 ,r/memes
drippy kitty,8 hours ,4 ,r/memes
haha I'm fine 🙂,4 hours ,4 ,r/animememes
Knowledge overload,4 hours ,0 ,r/memes
What have I done?,2 hours ,7 ,r/memes
Blowing 🎇 Book,9 hours ,14 ,r/memes
Disney: I'll allow man shaming,7 hours ,6 ,r/memes
Hmmm,3 hours ,12 ,r/trippinthroughtime
How to punish a 7 year old,8 hours ,1 ,r/memes
why tho,3 hours ,3 ,r/memes
"Dang it, let me be!",9 hours ,2 ,r/memes
feelsgoodman,21 hours ,1 ,r/memes
"In a vision, an angel had told him, ""you will leave this world with your wings stretched wide.""",2 hours ,12 ,r/TwoSentenceHorror
really? you 'happen' to record yourself doing nice things all the time?,16 hours ,9 ,r/memes
Special Person for me,9 hours ,2 ,r/memes
Came up with this while suffering from insomnia,4 hours ,2 ,r/memes
"[OC] I don't know if he deserves to be here or not, but he is a good boy.",6 hours ,230 ,r/aww
Here’s a joke I actually came up with myself (very proud),2 minutes ,0 ,r/dadjokes
the next six are quite the bangers,5 hours ,7 ,r/memes
"As the countdown approached zero, the astronaut couldn’t keep the fact that every single part of the craft was made by the lowest bidder out of her head.",14 hours ,64 ,r/TwoSentenceHorror
meirl,19 hours ,397 ,r/meirl
True...,1 day ,2 ,r/memes
haunted,1 day ,14 ,r/memes
Ahh yes harness With max efficiency.,21 hours ,5 ,r/memes
know thy testicle pain,23 hours ,13 ,r/memes
Everyone,41 minutes ,0 ,r/memes
Stay strong and remember the name,12 hours ,3 ,r/memes
"Normal sleep schedule, what’s that?",21 hours ,0 ,r/memes
That's what heroes do,6 hours ,13 ,r/memes
You can vacuum and vacuum and vacuum but there’s still hair,44 minutes ,0 ,r/memes
F-22 just cruising around,39 minutes ,0 ,r/memes
"Don'tcha call me pudgy, portly or stout Just now tell me once again who's fat",7 hours ,23 ,r/memes
what I see without my sunglasses,17 hours ,1 ,r/memes
Roger Federer keeping a pinky promise,6 hours ,374 ,r/MadeMeSmile
do it again,36 minutes ,0 ,r/memes
Spanish flu moment,7 hours ,4 ,r/memes
Self feeding fire,7 hours ,276 ,r/redneckengineering
best candidate,5 hours ,12 ,r/memes
the only not right way,34 minutes ,0 ,r/memes
Staff at an assisted living facility made a slip and slide for their residents,7 hours ,24 ,r/MadeMeSmile
it always is,16 hours ,2 ,r/memes
Meirl,1 day ,199 ,r/meirl
Wow… 2 years wasted,18 minutes ,0 ,r/memes
This is what people say to me,34 minutes ,4 ,r/memes
Dude wtf,17 minutes ,0 ,r/memes
"I, for one, welcome our fried chicken overlords",14 hours ,0 ,r/memes
Thank you... 😢😮😃,16 minutes ,0 ,r/memes
Where's the tux?,35 minutes ,0 ,r/memes
What did I do to deserve this punishment?,19 hours ,3 ,r/memes
facts...,33 minutes ,0 ,r/memes
Back Pocket vs Front Pocket,57 minutes ,17 ,r/memes
Massive F in the chat for this guy who got friendzoned in front of the entire stadium,9 minutes ,0 ,r/memes
Get ready fuckers,49 minutes ,5 ,r/memes
This is how it should be,15 hours ,11 ,r/memes
It's all gone tits up,6 hours ,1 ,r/memes
"And ""her/majesty"" for the Queen",1 hour ,2 ,r/memes
witchcraft for the win,4 hours ,8 ,r/memes
Never touch a Police man's car.,47 minutes ,3 ,r/memes
Went to pick up paint when suddenly,4 minutes ,0 ,r/memes
I wasn't.,5 minutes ,0 ,r/memes
"In a vision, an angel had told him, ""you will leave this world with your wings stretched wide.""",3 hours ,12 ,r/TwoSentenceHorror
we all been there,5 hours ,5 ,r/memes
Merlin Plot,20 hours ,0 ,r/memes
i ate it....;),10 hours ,3 ,r/memes
ImPoStEr GeTs SlAuGhTeReD WiTh ThE HeRd,2 hours ,1 ,r/PeopleFuckingDying
"Seriously, r/pics has been nothing but that for some time now",44 minutes ,2 ,r/memes
Have a nice day everyone!,2 hours ,0 ,r/memes
Hope you find love again,9 hours ,4 ,r/memes
Top one percent,6 hours ,0 ,r/memes
[@lewishamilton] on Instagram - a cheeky dig at Fernando from Lewis!,5 hours ,561 ,r/formula1
WAIT NO,5 hours ,4 ,r/memes
where's the parmesan cheese,6 hours ,2 ,r/memes
Poor Americans,11 hours ,13 ,r/memes
mf better sleep with 7 eyes open,4 hours ,3 ,r/memes
🗿,20 hours ,14 ,r/shitposting
I hate you,5 hours ,6 ,r/memes
Nowadays situation of the west :-),14 hours ,5 ,r/memes
Goofy ahh Twitch 🤡,3 hours ,4 ,r/memes
This is just my opinion but whatever,8 hours ,8 ,r/memes
The Boston Tea Party is formed (1773),5 hours ,35 ,r/fakehistoryporn
That's It,9 hours ,0 ,r/memes
the holy side of the force is a pathway to many abilities...,6 hours ,1 ,r/memes
They are getting bigger by the minute,12 hours ,1 ,r/memes
How to make a grown man happy.,19 hours ,144 ,r/MadeMeSmile
Last night I gave my kids a lesson in democracy. They voted on which movie to watch and the type of pizza they prefer.,2 minutes ,0 ,r/dadjokes
Blursed Robert,3 hours ,0 ,r/memes
are we there yet?,7 hours ,3 ,r/memes
The only disgusting thing guys want,3 hours ,9 ,r/memes
Not today,2 hours ,4 ,r/memes
Self feeding fire,3 hours ,102 ,r/lifehacks
Bing: How to become a basketball coach?,1 hour ,2 ,r/memes
Is it worth it?,11 hours ,5 ,r/memes
There is another,12 hours ,5 ,r/memes
Flashy flashy free parky button,1 hour ,2 ,r/memes
meirl,1 day ,313 ,r/meirl
7 years later,4 hours ,1 ,r/memes
It’s funny cause it’s true,55 minutes ,3 ,r/memes
My dating life in a nutshell,1 day ,13 ,r/memes
Pull up in a ford focus,31 minutes ,1 ,r/memes
Me when I sign a contract without looking,13 hours ,6 ,r/shitposting
"You know, I’m a bit of a master gardener myself",2 hours ,2 ,r/memes
Always thought this is how Intentions went...,2 hours ,0 ,r/memes
"A ""legal"" way to do the same thing...",6 hours ,8 ,r/memes
Halloween is coming,2 hours ,6 ,r/memes
"""See Josh, I told you the cave wasn't a complex as you thought!"", I exclaimed in relief, turning to my friend.",3 hours ,6 ,r/TwoSentenceHorror
Hugh Jackman is a fucking dancer,3 hours ,2 ,r/memes
needless to say my excitement was short lived,3 hours ,6 ,r/memes
Well that’s just lazy writing.,2 hours ,0 ,r/memes
"I am a young female and sometimes when I walk alone at night, I have random men calling me from their car. Why do men do this?",3 hours ,269 ,r/NoStupidQuestions
which is your favorite?,4 hours ,925 ,r/memes
pro gamer move,11 hours ,0 ,r/memes
Everyone,43 minutes ,0 ,r/memes
You can vacuum and vacuum and vacuum but there’s still hair,45 minutes ,0 ,r/memes
F-22 just cruising around,41 minutes ,0 ,r/memes
if you stop gambling right now you'll miss out on a trillion dollars 🤑,16 hours ,5 ,r/memes
do it again,38 minutes ,0 ,r/memes
the only not right way,36 minutes ,0 ,r/memes
Can't get enough sleep. Memes are important,1 day ,3 ,r/memes
Wow… 2 years wasted,20 minutes ,0 ,r/memes
This is what people say to me,36 minutes ,4 ,r/memes
Dude wtf,19 minutes ,0 ,r/memes
Thank you... 😢😮😃,17 minutes ,0 ,r/memes
Where's the tux?,37 minutes ,0 ,r/memes
Quandale Dingle,16 hours ,1 ,r/memes
facts...,35 minutes ,0 ,r/memes
"bloggers are ""creative"" people",20 hours ,2 ,r/memes
Back Pocket vs Front Pocket,59 minutes ,17 ,r/memes
Massive F in the chat for this guy who got friendzoned in front of the entire stadium,11 minutes ,0 ,r/memes
Anyone hungry for a midknight snack?,5 hours ,0 ,r/memes
Its either that or a mug,13 hours ,1 ,r/memes
Get ready fuckers,51 minutes ,5 ,r/memes
But can you do this?,4 hours ,1 ,r/memes
Never touch a Police man's car.,48 minutes ,3 ,r/memes
Went to pick up paint when suddenly,6 minutes ,0 ,r/memes
I wasn't.,7 minutes ,0 ,r/memes
"Seriously, r/pics has been nothing but that for some time now",46 minutes ,2 ,r/memes
What are the requirements to stop being an animal and start being a creature/monster?,2 hours ,4 ,r/NoStupidQuestions
What ever will they throw?,16 minutes ,0 ,r/memes
took me a while to understand,3 hours ,6 ,r/memes
oh no the cringe,5 hours ,3 ,r/memes
Way too busy for this,13 hours ,1 ,r/memes
Winter is coming…,8 hours ,2 ,r/memes
Whale Shark sucking fish from a net,10 hours ,240 ,r/TheDepthsBelow
Game bad me angy,3 hours ,0 ,r/memes
why won't the cross work..,16 hours ,3 ,r/memes
They're the same thing,18 minutes ,0 ,r/memes
She-Hulk thinks she knows...,30 minutes ,3 ,r/memes
sIcK fUcK drOWnS iNnOCenT bIRB,16 hours ,9 ,r/PeopleFuckingDying
What side you on?,6 hours ,103 ,r/memes
01010100 01101000 01100101 01110010 01100101 00100000 01101001 01110011 00100000 01100001 01101110 01101111 01110100 01101000 01100101 01110010,12 hours ,13 ,r/memes
"If you remember hin from the latter three, you are a TRUE Chad.",18 hours ,3 ,r/memes
OMG HEY LOISS,4 hours ,1 ,r/memes
Funny Grub,9 hours ,67 ,r/HollowKnightMemes
cat surfing?,2 hours ,0 ,r/memes
but yes,10 minutes ,0 ,r/memes
Can't wait to burn listening to it,10 hours ,2 ,r/memes
muskles,7 hours ,1 ,r/memes
Fascinating magic trick ✨️ 🎩,8 hours ,50 ,r/SipsTea
Absolutely not,3 hours ,43 ,r/memes
Pumpkins just taste like they're made of damp cardboard.,3 hours ,3 ,r/memes
I'm proud of myself,2 hours ,12 ,r/memes
Thank you so much,9 hours ,25 ,r/memes
There's too many gun shots,21 hours ,29 ,r/memes
Yeh! You let him know terry.,6 hours ,338 ,r/Unexpected
Just smile and nod,12 hours ,29 ,r/meme
Alright that one stings a little,13 hours ,0 ,r/memes
Coincidence? I think not,13 hours ,24 ,r/memes
A miracle,21 hours ,285 ,r/memes
shitpost,13 hours ,3 ,r/memes
Would you try this?,1 day ,5 ,r/memes
Every time,21 hours ,6 ,r/memes
Everyone,47 minutes ,0 ,r/memes
What a rebellious lad,22 hours ,5 ,r/memes
chaos at the boys sleep over,15 hours ,0 ,r/memes
thank you fellow stranger. (oc-u/MRchewingun),3 hours ,36 ,r/memes
what would i do?,2 hours ,13 ,r/memes
You can vacuum and vacuum and vacuum but there’s still hair,49 minutes ,0 ,r/memes
THE MORE USES THE BETTER!!!!,21 hours ,3 ,r/memes
F-22 just cruising around,44 minutes ,0 ,r/memes
do it again,41 minutes ,0 ,r/memes
its so sad joe died of ligma,1 day ,12 ,r/memes
Backrooms Drip,23 hours ,2 ,r/memes
that's what we call 'reposting',1 day ,4 ,r/memes
True love exists,5 hours ,1 ,r/memes
the only not right way,40 minutes ,0 ,r/memes
protein drinks vs juice (pop/Gatorade etc),4 hours ,6 ,r/HealthyFood
Sentence gymnastics.,8 hours ,4 ,r/memes
Wow… 2 years wasted,24 minutes ,0 ,r/memes
This is what people say to me,40 minutes ,4 ,r/memes
Still 99 cents!,20 hours ,20 ,r/memes
Dude wtf,23 minutes ,0 ,r/memes
Guys I’m LGBT I can make this joke,7 hours ,71 ,r/memes
Thank you... 😢😮😃,21 minutes ,0 ,r/memes
So me 💯,11 hours ,7 ,r/memes
Where's the tux?,40 minutes ,0 ,r/memes
☠️😴🤷🏼‍♀️🫦,7 hours ,1 ,r/memes
It's going to happen to me soon.,9 hours ,7 ,r/memes
Sweet dreams to all my homies,3 hours ,0 ,r/memes
facts...,39 minutes ,0 ,r/memes
It gets so lonely here,2 hours ,4 ,r/memes
Back Pocket vs Front Pocket,1 hour ,17 ,r/memes
buzz buzz mufferfugger,16 hours ,4 ,r/memes
Massive F in the chat for this guy who got friendzoned in front of the entire stadium,14 minutes ,0 ,r/memes
Kirby’s calling the police,16 hours ,28 ,r/memes
Get ready fuckers,54 minutes ,5 ,r/memes
OnlyFans 'content' creator engages with potential new subscriber. (Yakuza 0),3 hours ,0 ,r/memes
Where's the beef?,14 hours ,1 ,r/memes
who else agrees,17 hours ,4 ,r/memes
Never touch a Police man's car.,52 minutes ,3 ,r/memes
Went to pick up paint when suddenly,10 minutes ,0 ,r/memes
I wasn't.,10 minutes ,0 ,r/memes
Special Person for me,10 hours ,2 ,r/memes
Came up with this while suffering from insomnia,5 hours ,2 ,r/memes
"Seriously, r/pics has been nothing but that for some time now",50 minutes ,2 ,r/memes
Have a nice day everyone!,3 hours ,0 ,r/memes
The only disgusting thing guys want,4 hours ,9 ,r/memes
It’s funny cause it’s true,59 minutes ,3 ,r/memes
Pull up in a ford focus,35 minutes ,1 ,r/memes
What ever will they throw?,19 minutes ,0 ,r/memes
They're the same thing,21 minutes ,0 ,r/memes
She-Hulk thinks she knows...,33 minutes ,3 ,r/memes
but yes,13 minutes ,0 ,r/memes
What are your favorite basil recipes?,15 hours ,3 ,r/HealthyFood
Guatemala ‘87,1 hour ,8 ,r/memes
"i saw a meme exactly like this, i just remade it and added mussolinis “thing”",7 hours ,9 ,r/memes
POV: You are on a dating app in Los Angeles,4 minutes ,0 ,r/memes
Please help me,5 hours ,2 ,r/memes
Based on a true story,4 hours ,3 ,r/memes
Civil Candy cane discussions,19 hours ,217 ,r/discordVideos
The storm is approaching,7 hours ,3 ,r/memes
Advanced humour,2 hours ,5 ,r/memes
Your point?,1 hour ,4 ,r/memes
this is indeed my cat,2 hours ,0 ,r/memes
Persevere,10 hours ,8 ,r/FunnyandSad
Working isn't stressful at all...,58 minutes ,39 ,r/memes
when you can't have fun with something so you make evreybody else not uave fun either,5 hours ,7 ,r/memes
🇨🇳唷馬你個👲👍,7 hours ,3 ,r/memes
Rumors has it he is still out there,4 hours ,6 ,r/memes
Guy asked random guy who's the hottest red sox player,13 hours ,3.6k ,r/Unexpected
Just a reminder.,3 hours ,6 ,r/memes
He's a thief,7 hours ,1 ,r/memes
This just really crosses a line.,8 hours ,6 ,r/memes
oh Bruh!💀,4 hours ,16 ,r/memes
Smol bottle fed baby,11 hours ,63 ,r/IllegallySmolCats
1500s jobs then vs jobs now,3 hours ,7 ,r/memes
always carrying convos,12 hours ,6 ,r/memes
Reminds me of that tragedy,2 hours ,2 ,r/memes
"If I give myself terminal cancer from huffing rubber cement, can I get the Make-A-Wish Foundation to force Oprah Winfrey and Dr. Phil to do a threesome with me?",1 hour ,4 ,r/shittyaskreddit
Would have been a great twist,1 minute ,0 ,r/memes
When inflations too high to increase prices and supply is down,just now,0 ,r/memes
me irl,8 hours ,7 ,r/me_irl
Hey guys did you know that,15 hours ,345 ,r/shitposting
man wtf going on in fortnite,14 hours ,78 ,r/shitposting
"Just before she died, my Grandmother held me and my baby close and whispered, ""he has my eyes!""",22 hours ,131 ,r/TwoSentenceHorror
me_irl,9 hours ,92 ,r/me_irl
Me_irl,14 hours ,16 ,r/me_irl
But where does he go??,9 hours ,0 ,r/me_irl
me_irl,15 hours ,15 ,r/me_irl
Me_irl,6 hours ,2 ,r/me_irl
me_irl,2 hours ,2 ,r/me_irl
MeIRL,9 hours ,5 ,r/me_irl
Me_irl,9 hours ,5 ,r/me_irl
me: I'm just gunna open this draw... My spatula The FUCK YOU ARE,19 hours ,3 ,r/memes
live up to their own name,10 hours ,6 ,r/memes
Everyone,48 minutes ,0 ,r/memes
My ex finally remembered our anniversary date.,9 hours ,2 ,r/TwoSentenceHorror
You can vacuum and vacuum and vacuum but there’s still hair,51 minutes ,0 ,r/memes
F-22 just cruising around,46 minutes ,0 ,r/memes
It’s funny sorry,14 hours ,4 ,r/memes
Oh God not this,22 hours ,2 ,r/memes
do it again,43 minutes ,0 ,r/memes
me_irl,15 hours ,118 ,r/me_irl
the only not right way,41 minutes ,0 ,r/memes
It became my dad,1 day ,3 ,r/memes
"oh life, what have you done?",13 hours ,8 ,r/memes
Wow… 2 years wasted,26 minutes ,0 ,r/memes
This is what people say to me,42 minutes ,4 ,r/memes
"At that moment, you don't know what to feel.",15 hours ,4 ,r/memes
Dude wtf,25 minutes ,0 ,r/memes
oh not good,4 hours ,4 ,r/memes
Only for Ryan Gosling,3 hours ,1 ,r/memes
Thank you... 😢😮😃,23 minutes ,0 ,r/memes
evil go pro be like,15 hours ,2 ,r/memes
Where's the tux?,42 minutes ,0 ,r/memes
It’s hunting season,21 hours ,184 ,r/shitposting
facts...,41 minutes ,0 ,r/memes
Massive F in the chat for this guy who got friendzoned in front of the entire stadium,16 minutes ,0 ,r/memes
Get ready fuckers,56 minutes ,5 ,r/memes
Never touch a Police man's car.,54 minutes ,3 ,r/memes
Went to pick up paint when suddenly,11 minutes ,0 ,r/memes
I wasn't.,12 minutes ,0 ,r/memes
Merlin Plot,21 hours ,0 ,r/memes
"Seriously, r/pics has been nothing but that for some time now",51 minutes ,2 ,r/memes
It’s funny cause it’s true,1 hour ,3 ,r/memes
Pull up in a ford focus,37 minutes ,1 ,r/memes
What ever will they throw?,21 minutes ,0 ,r/memes
They're the same thing,23 minutes ,0 ,r/memes
She-Hulk thinks she knows...,35 minutes ,3 ,r/memes
but yes,15 minutes ,0 ,r/memes
POV: You are on a dating app in Los Angeles,6 minutes ,0 ,r/memes
Working isn't stressful at all...,1 hour ,39 ,r/memes
Would have been a great twist,3 minutes ,0 ,r/memes
When inflations too high to increase prices and supply is down,2 minutes ,0 ,r/memes
Krillen,2 minutes ,0 ,r/memes
Dick shaped space ships 🍆,3 minutes ,0 ,r/memes
lt makes them look not caring,10 hours ,5 ,r/memes
Racist NPC programmed for cowardice 🐶,7 hours ,5 ,r/NPC_irl
i thought i was above it..,1 hour ,1 ,r/memes
Why they trying to do me in like dat;-;,3 hours ,6 ,r/memes
Well i wasn’t mad until you tried to make me feel guilty for having a life,1 hour ,2 ,r/memes
it's a deep psychological horror... yea sure thing pal.,6 hours ,7 ,r/memes
And it slides around like no tomorrow,9 hours ,3 ,r/meme
i fucking hate this guy,11 hours ,1 ,r/memes
People pay so much for simple avatars here,5 hours ,5 ,r/memes
bull season is approaching,8 hours ,8 ,r/memes
some weaknesses are more fatal than others,2 hours ,10 ,r/memes
"I lost. I had a streak of about 7 months, I think. Or more",3 hours ,1 ,r/TheGame
I smell a lawsuit.,1 hour ,9 ,r/memes
Webcore is amazing.,6 hours ,4 ,r/memes
sucks to be ugly,5 hours ,1 ,r/memes
Only if you actually paid for the avata(also no offense to the guy I took the picture of the avatar from),3 hours ,8 ,r/memes
"Pakistan: 18-year-old girl marries 55-year-old man, says Bobby Deol song brought them close",15 hours ,2 ,r/NotThePyaaz
digits ...,11 hours ,3 ,r/memes
Even though I enjoyed Last of us part 2.,10 hours ,2 ,r/memes
Your wish is granted,6 hours ,11 ,r/memes
There's an imposter among us!,2 hours ,0 ,r/ActLikeYouBelong
me_irl,18 hours ,25 ,r/me_irl
"Trying to fuse pie, cobbler and tart in one super dessert.",2 minutes ,0 ,r/memes
would be a happy moment in life,2 minutes ,0 ,r/memes
my first pov meme (I know it's bad),2 minutes ,0 ,r/memes
To the monk,2 minutes ,0 ,r/memes
anime_irl,18 hours ,19 ,r/anime_irl
this one is sooo true,2 minutes ,0 ,r/memes
When the villain who cost the hero so much to defeat turns out to be a weakling retroactively.,19 hours ,1 ,r/memes
Our battle will be legendary!,8 hours ,5 ,r/memes
the puplils repeablic of Chaina,2 hours ,2 ,r/memes
"As I stood in front of the cameras, I begged desperately for the return of my missing child.",9 hours ,13 ,r/TwoSentenceHorror
watch other things if you don't like it.,3 hours ,6 ,r/memes
"Ok, dragons aaaaand....",2 hours ,4 ,r/memes
the bombardment is upon us,2 hours ,3 ,r/memes
No chopsticks for dad? Just use a Barbie doll!,11 hours ,536 ,r/funny
Quiet Quitting is a new trend...... Simpsons in 1995,19 hours ,5 ,r/memes
Right stat!,4 hours ,3 ,r/memes
Sometimes ignorance is bliss,16 hours ,0 ,r/memes
Wholesome moment,11 hours ,0 ,r/memes
Thailand road signs,23 hours ,12 ,r/memes
Think imma try this the next time.,20 hours ,6 ,r/memes
Everyone,53 minutes ,0 ,r/memes
I can hear his accent,23 hours ,14 ,r/memes
What Djokovic's retirement ceremony will look like,7 hours ,0 ,r/memes
"Seriously though, you guys know Disney is paying meme creators right?",23 hours ,4 ,r/memes
Uthi kutheni?,20 hours ,5 ,r/memes
Uh-Oh...,19 hours ,6 ,r/memes
H---O---H,16 hours ,1 ,r/memes
there's really no need to rub it in,22 hours ,5 ,r/memes
"Please, Markie. let me have my fb.",21 hours ,0 ,r/memes
You can vacuum and vacuum and vacuum but there’s still hair,55 minutes ,0 ,r/memes
F-22 just cruising around,51 minutes ,0 ,r/memes
At least it ain’t Detroit,12 hours ,0 ,r/memes
they have black air force energy,4 hours ,0 ,r/memes
do it again,48 minutes ,0 ,r/memes
Don’t you dare,16 hours ,5 ,r/memes
And what do you mean touch grass? What the hell is grass,1 day ,0 ,r/memes
the only not right way,46 minutes ,0 ,r/memes
i guess I don't always need to keep hair gel out,23 hours ,0 ,r/memes
parents am I right?,23 hours ,5 ,r/memes
Why??? Just why?,22 hours ,3 ,r/memes
To everyone using one of these new NFT profile pics:,19 hours ,8 ,r/memes
I swear we must have been traveling at the speed of light,5 hours ,0 ,r/memes
What a view mom,22 hours ,3 ,r/memes
I might be early to the party,19 hours ,4 ,r/memes
so long beach bod...,23 hours ,1 ,r/memes
original meme by u/imallorganic,8 hours ,8 ,r/memes
This little girl can hoop. Amazing !,6 hours ,114 ,r/toptalent
Wow… 2 years wasted,30 minutes ,0 ,r/memes
This is what people say to me,46 minutes ,4 ,r/memes
"just discovered it, a bit weird",21 hours ,0 ,r/memes
A scathing indictment of society,7 hours ,5 ,r/memes
Dude wtf,29 minutes ,0 ,r/memes
Thank you... 😢😮😃,27 minutes ,0 ,r/memes
Cashin dem hairy ass checks,6 hours ,0 ,r/memes
Where's the tux?,47 minutes ,0 ,r/memes
Worst kind of internal pain,7 hours ,2 ,r/memes
Discussing House of the Dragons at work,9 hours ,3 ,r/memes
facts...,45 minutes ,0 ,r/memes
Massive F in the chat for this guy who got friendzoned in front of the entire stadium,20 minutes ,0 ,r/memes
How else am I gonna save 30 seconds?,20 hours ,38 ,r/memes
For fuck sake Billy,22 hours ,1.6k ,r/funny
Get ready fuckers,1 hour ,5 ,r/memes
Who else feels this?,13 hours ,9 ,r/memes
Never touch a Police man's car.,58 minutes ,3 ,r/memes
Went to pick up paint when suddenly,16 minutes ,0 ,r/memes
I wasn't.,16 minutes ,0 ,r/memes
Knowledge overload,5 hours ,0 ,r/memes
"Seriously, r/pics has been nothing but that for some time now",56 minutes ,2 ,r/memes
They are getting bigger by the minute,13 hours ,1 ,r/memes
Flashy flashy free parky button,2 hours ,2 ,r/memes
Pull up in a ford focus,41 minutes ,1 ,r/memes
What ever will they throw?,26 minutes ,0 ,r/memes
oh no the cringe,6 hours ,3 ,r/memes
They're the same thing,28 minutes ,0 ,r/memes
She-Hulk thinks she knows...,39 minutes ,3 ,r/memes
sIcK fUcK drOWnS iNnOCenT bIRB,17 hours ,9 ,r/PeopleFuckingDying
but yes,19 minutes ,0 ,r/memes
POV: You are on a dating app in Los Angeles,10 minutes ,0 ,r/memes
Your point?,2 hours ,4 ,r/memes
Would have been a great twist,7 minutes ,0 ,r/memes
When inflations too high to increase prices and supply is down,7 minutes ,0 ,r/memes
Krillen,7 minutes ,0 ,r/memes
Dick shaped space ships 🍆,7 minutes ,0 ,r/memes
"Trying to fuse pie, cobbler and tart in one super dessert.",6 minutes ,0 ,r/memes
would be a happy moment in life,6 minutes ,0 ,r/memes
my first pov meme (I know it's bad),6 minutes ,0 ,r/memes
To the monk,6 minutes ,0 ,r/memes
this one is sooo true,5 minutes ,0 ,r/memes
"I am bad at cropping :,(",30 minutes ,3 ,r/memes
Driving an automatic with both feet,3 hours ,157 ,r/NoStupidQuestions
If she hasn't roared after 8 years does that make her a liar?,3 hours ,2 ,r/memes
feel the pain,44 minutes ,1 ,r/memes
Such a drama queen..,3 hours ,1 ,r/memes
Don't acknowledge him. Just act natural.,6 hours ,3 ,r/memes
Honestly an iconic era,19 hours ,9 ,r/shitposting
I sure do love myself a classic game of UMC,11 hours ,8 ,r/memes
"Pedophiles, so hot right now!",3 hours ,6 ,r/memes
Nintendo smh,12 hours ,7 ,r/memes
NG+20 Dragonbarrow Bell bearing hunter gets bullied,10 hours ,242 ,r/Eldenring
Maybe she shouldn’t have left me there,2 minutes ,0 ,r/memes
top of the morning fellow kids,3 minutes ,0 ,r/memes
A blonde woman visits her husband in prison.,9 hours ,179 ,r/Jokes
me_irl,8 hours ,0 ,r/me_irl
2 blind men were having a fight,15 hours ,27 ,r/Jokes
"A friend of mine, a performing arts student, was recently killed in an accident in Toronto…",5 hours ,2 ,r/Jokes
I'm not a fan of elevator music.,2 hours ,3 ,r/Jokes
Carl,18 hours ,29 ,r/shitposting
How do you tell if someone has kids?,15 hours ,18 ,r/Jokes
two italians,6 hours ,7 ,r/Jokes
"I drank a little too much at the bar last night, so I walked home...",1 day ,8 ,r/Jokes
A man is walking through his local mall and notices a Mexican book store.,12 hours ,4 ,r/Jokes
me_irl,3 hours ,3 ,r/me_irl
"I walked into a clairvoyant's today. She said, ""The brothel's next door.""",9 hours ,1 ,r/Jokes
Did you hear about the cemetery maintenance man who fell ill on the job?,4 hours ,1 ,r/Jokes
What do you call a were-dog’s cub?,1 hour ,0 ,r/Jokes
Why does a robot do during a one night stand?,19 hours ,7 ,r/Jokes
me_irl,8 hours ,1 ,r/me_irl
A man stumbles across an old oil lamp in an antique store...,7 hours ,0 ,r/Jokes
Man addicted to drinking brake fluid...,18 hours ,1 ,r/Jokes
An elderly woman is going through some old boxes of clothes.,22 hours ,2 ,r/Jokes
"Beautiful bird in the sky, why did you do that right in my eye?",5 hours ,3 ,r/Jokes
😱,21 hours ,50 ,r/shitposting
Everyone,55 minutes ,0 ,r/memes
The nunnery and the building site (one offensive word included),17 hours ,3 ,r/Jokes
"The student loan forgiveness plan is offering $10,000 in loan forgiveness for people making under $125k….",17 hours ,8 ,r/Jokes
I would like to talk to who tf started this,1 day ,7 ,r/memes
You can vacuum and vacuum and vacuum but there’s still hair,57 minutes ,0 ,r/memes
She apparently got around,2 hours ,2 ,r/memes
