Title,Time,Comments,Subreddit
"I've been photoshopping my kid into marginally dangerous situations. Nothing unbelievable, but enough to make people think ""Wait, did he..?""",5 years ,3.8k ,r/pics
Poor degrees,2 years ,1.6k ,r/memes
This one goes out to all the Twitch gamers who try their best,2 years ,3.7k ,r/gaming
movie magic,2 years ,1.3k ,r/memes
even super villains gotta cook and clean,2 years ,701 ,r/memes
It’s always with my best shirts,1 year ,1.2k ,r/memes
Yo mama fat,2 years ,819 ,r/memes
"A Bird Story in Pictures. Dayton, OH.",1 year ,2 ,r/birding
A Bird Story by FidzFox,2 years ,33 ,r/mylittlepony
A Bird Story and Finding Paradise left me in emotional shambles,2 years ,11 ,r/patientgamers
Vylet Pony - A Bird Story,2 years ,1 ,r/MLPtunes
A Bird Story by FidzFox,2 years ,5 ,r/MylittleAnthro
A bird story.,2 years ,1 ,r/budgies
"Share your ""got hit by a bird"" story...",5 years ,65 ,r/motorcycles
Cloud Knights + Defend Your Life + A Bird Story [Info in comments],6 years ,69 ,r/FreeGamesOnSteam
"[Steam] (Game) Cloud Knights, A Bird Story, Defend Your Life",6 years ,52 ,r/FreeGameFindings
A Bird Story by FidzFox,2 years ,1 ,r/celestia
A Bird Story by FidzFox,2 years ,1 ,r/twilightsparkle
"Kan Gao on ""To the Moon"" and the upcoming ""A Bird Story""",8 years ,43 ,r/Games
"Ah, so that's why it's not on consoles. (A Bird Story)",8 years ,20 ,r/pcmasterrace
"[Steam] (Game) A Bird Story, Base Squad 24, Chicken Shoot 2, Unknown Battle, Pirates of Black Cove - Gold Edition , The Troma Project, defend your life, pressure , shut up and dig, Jet Racing Extreme , shake your money simulator 2016",6 years ,26 ,r/FreeGameFindings
A Bird Story (To The Moon's Spiritual Follow-up) - Trailer,8 years ,17 ,r/Games
"[Steam] (Game) A Bird Story, Base Squad 24, Chicken Shoot 2, Unknown Battle, Pirates of Black Cove - Gold Edition , The Troma Project, defend your life, pressure , shut up and dig",6 years ,13 ,r/FreeGameFindings
"Should we play A Bird Story, before Finding Paradise?",5 years ,7 ,r/ToTheMoonGame
"[Steam] (Game) A Bird Story, Base Squad 24, Chicken Shoot 2, Unknown Battle, Pirates of Black Cove - Gold Edition",6 years ,13 ,r/FreeGameFindings
"[Winter Sale Day 12 - Flash Sale 22] Serious Sam 3 (90% off - $3.99), Two Worlds 2 (90% off - $1.99), Half-Life 2 (75% off - $2.49), Shadowgate (75% off - $4.99), A Bird Story (50% off - $2.49), Gang Beasts (33% off - $13.39)",8 years ,6 ,r/steamdeals
"[Bundle Stars] All Stars 2 Bundle - Alien Rage Unlimited, S.T.A.L.K.E.R Shadow of Chernobyl, Mount and Blade, Broken Sword: Director's Cut, Pool Nation, A Bird Story, Spy Chameleon - RGB Agent, Duke Nukem: Manhattan Project - $1.99 before price increase",7 years ,7 ,r/steamr
"A bird story, sampled from disney and bbc, with my music!",8 years ,10 ,r/futurebeatproducers
"3スチームキー(Cloud Knights,Defend Your Life,A Bird Story) 無料",6 years ,3 ,r/steamr
"Official site launched for ""A Bird Story"", a short game that will act as a prelude to the second episode of the ""To the Moon"" series",9 years ,4 ,r/Games
Beekeeper protecting his bees from being attacked by hornets,3 hours ,2.2k ,r/nextfuckinglevel
Tourists in Mexico have a tense encounter with a black bear,13 hours ,3.8k ,r/interestingasfuck
"What does society consider ""attractive"" that you absolutely can’t stand?",11 hours ,12.0k ,r/AskReddit
Little Egg Harbor PD (NJ) cops detained a young man in handcuffs because he flipped one of them off. Young man wasn't having any of it!,17 hours ,4.5k ,r/PublicFreakout
Try going a whole day without shooting an innocent person,2 hours ,434 ,r/MurderedByWords
This in flight proposal,3 hours ,942 ,r/MadeMeSmile
Amazon is Inhumane,15 hours ,3.7k ,r/antiwork
Please write in English,3 hours ,439 ,r/facepalm
Jeff Bezos is one Alexa away from using prison labors.,15 hours ,3.2k ,r/mildlyinfuriating
"Jackson, Mississippi, water system is failing, city to be with no or little drinking water indefinitely",13 hours ,2.6k ,r/news
"Republicans are increasingly sharing misinformation, research finds",3 hours ,1.5k ,r/technology
Fuck long covid,16 hours ,2.6k ,r/AdviceAnimals
An attempt to embarrass a climate change activist backfires,14 hours ,2.5k ,r/WatchPeopleDieInside
Guy asked random guy who's the hottest red sox player,7 hours ,2.2k ,r/Unexpected
Ricardo went full aussie,4 hours ,184 ,r/formuladank
[OC] saw this guy stealing a mirror in a parking lot and he was packing serious heat,11 hours ,2.1k ,r/pics
"Most legit one I’ve seen yet, $300 on Amazon",22 hours ,2.1k ,r/Justrolledintotheshop
Did they really think he'd pay out?,18 hours ,1.9k ,r/LeopardsAteMyFace
Minecraft censoring,14 hours ,1.8k ,r/Minecraft
Went to a friends farm look closely every black dot is a tick,15 hours ,1.6k ,r/Wellthatsucks
A thought occurred to me while taking my business and finance exam. Why exactly am I studying a bachelors in economics?,2 months ,91 ,r/Superstonk
I have 6 essays in Economics and Finance that are 2500 words each due in 2 days,17 days ,67 ,r/Essay_Writing_Service
"good/interesting book to expand my knowledge in finance, economics and business.",4 months ,23 ,r/FinancialCareers
"Texas needs to build out a network of passenger rail lines. It would do so much for our state in terms of economics, business, environment, and travel.",2 months ,611 ,r/texas
"Rejected from UT McCombs Business, Accepted into UH Mays Honors. UT Economics or UH Honors in Finance?",5 months ,18 ,r/UTAustin
Can a graduate not from accounting / finance background but economics venture in internal audit ?,1 month ,37 ,r/InternalAudit
"Interested in swing trading and maybe investing. I've got some knowledge about economics and finance, but is it enough?",24 days ,21 ,r/StockMarket
What's the best way to learn about finance economics?,10 days ,5 ,r/AskEconomics
Is it still worth it to study economics for working in finance in 2022 ?,1 month ,22 ,r/AskEconomics
"“Get a degree in accounting, it’s the engineers of business. Accountants can be finance guys but finance guys can’t be accountants”",26 days ,92 ,r/Accounting
"Amid slow return-to-the-office efforts, downtown leaders shift gears - After months of prodding, waiting and hoping for a return to normalcy, business and city leaders are changing course and planning for a future in which downtown SF is no longer a daily hub of tech and finance workers.",1 month ,110 ,r/bayarea
"Biden rebukes the criticism that student-loan forgiveness is unfair, asks if it's fair for only multi-billion-dollar business owners to get tax breaks",6 days ,8.0k ,r/politics
since they said its the midpoint here you go the midpoint of economics and business for my fellow commerce mates,15 days ,30 ,r/igcse
"Is it realistic to learn SQL on my own, then find a J2 as a data analysts/business analyst? My background is finance (corp banking and corp dev)",20 days ,62 ,r/overemployed
I have just achieved a First Class Honours in BA Economics and Finance!,2 months ,37 ,r/UniUK
"McDonalds CEO: Robots won't take over our kitchens ""the economics don't pencil out""",1 month ,2.3k ,r/Futurology
"Can’t decide if I wanna pursue pre med, pre law, business, economics or data science. Does anyone have any advice lol",20 days ,26 ,r/nyu
1 year into Business Finance Partnering. Don't have accounting background. I joined the role after MBA. What is the best way to learn Accounting? I want to be a CFO one day. What other skills should I learn?,3 days ,20 ,r/FPandA
This is my favorite subversive economics/finance sub,3 months ,52 ,r/REBubble
Is Economics a good degree for a job in finance or banking?,2 months ,16 ,r/AskEconomics
Current Gold Silver ratio 1:93(after rounding),5 hours ,4 ,r/Wallstreetsilver
"You live on TV, huh?",5 hours ,15 ,r/CatsAreAssholes
"""And you know what else Hector?""",4 hours ,7 ,r/pyrocynical
Pixel Ape Society | Weekly passive income rewards ✅ | DAO membership and fractionalised ownership ✅ | BUY NOW: 0.01 ETH ✅| Companion Baby Ape NFT for each purchase ✅| Check the roadmap and utilities from the link below. PRESALE LIVE!,4 hours ,5 ,r/NFTsMarketplace
Rainy Nights - Paprika_d,6 hours ,33 ,r/PixelArt
Whale Shark sucking fish from a net,5 hours ,99 ,r/TheDepthsBelow
"US assesses Russia now in possession of Iranian drones, sources say",1 hour ,2 ,r/worldnews
zot from holow knigh,7 hours ,13 ,r/HollowKnightMemes
Is it safe to say us Apes are pro gun on Wall Street Silver? We Damn Dirt Apes Stack Ammo and Silver!,15 hours ,22 ,r/Wallstreetsilver
It's not fair,6 hours ,412 ,r/memes
"""Stay out of my territory"" (Art/GIF Created by @DitchuArt on TWT)",9 hours ,69 ,r/Undertale
"Just started watching FMA, these two are definitely my favourite so far",2 hours ,217 ,r/animememes
me irl,4 hours ,1 ,r/meirl
Taste of Summer,6 hours ,8 ,r/animegifs
My Very Fragile Parcel From Amazon,23 hours ,1.2k ,r/funny
2 blind men were having a fight,9 hours ,16 ,r/Jokes
R U READY?,5 hours ,23 ,r/gifsthatendtoosoon
I hit every target in the slingshot minigame in 32 shots,10 hours ,156 ,r/StardewValley
"Tabula circuitu monochromæ | 22-10-17 | by Xponentialdesign | 5 editions • 3tz | As always, thank you for the precious support and please Re-tweet this post to support this dark circuitboard loop 👇",6 hours ,6 ,r/NFTsMarketplace
What is this?,3 hours ,511 ,r/interestingasfuck
this is just what i want fr,6 hours ,24 ,r/teenagers
"Introverts, you know we had a good time for a bit there",10 hours ,357 ,r/memes
"In the series Danny Phantom (2004-2007), our titular character's ability is dying on command, this is a reference to him being a millennial",6 hours ,19 ,r/shittymoviedetails
Sometimes it cuts deep with overtime and no pay.,4 hours ,16 ,r/ProgrammerHumor
Mint One Podcast LIVE: Gamescom 2022,6 hours ,1 ,r/NFT
anime_irl,10 hours ,151 ,r/anime_irl
this is probably my favorite parallel in all of fiction,14 hours ,111 ,r/OnePunchMan
Kitty doing the workout grind,2 hours ,2 ,r/Thisismylifemeow
"Mr. Murder, the murderer that defies all facial recognition...",12 hours ,723 ,r/Bossfight
Me irl,20 hours ,26 ,r/me_irl
Just smile and nod,6 hours ,16 ,r/meme
Fixed my post from yesterday. The only logical way this hot tub from Walmart works.,23 hours ,1.1k ,r/funny
"Reddit gave me this NFT and I don’t know what to do with it. If I want to sell it, where is the proper place?",7 hours ,6 ,r/NFT
Chad Peter,2 hours ,27 ,r/raimimemes
Woman is reunited with her dog that was missing for two weeks,11 hours ,312 ,r/MadeMeSmile
Podcast/radio show with Nichols Grossman about drone use in wars.,1 hour ,0 ,r/technology
IM GETTING A CAT,6 hours ,154 ,r/teenagers
Is this how they handle all online products?,7 hours ,252 ,r/IndianGaming
🔥 Vulture Joining a paraglide,3 hours ,204 ,r/NatureIsFuckingLit
DoG gOt bAked and tUrNed inTo biTe-siZed cAke,7 hours ,58 ,r/PeopleFuckingDying
Grew up to be quite the lass,18 hours ,209 ,r/wholesomememes
How about we ask the real question.,17 hours ,609 ,r/teenagers
"We've been hit by, we've been struck by a smooth swiminal [IG: kristimakusha]",12 hours ,186 ,r/toptalent
I have finally done it,21 hours ,115 ,r/wholesomememes
If we used 100% of our brain,10 hours ,248 ,r/facepalm
Showing off your new pole trick.,21 hours ,107 ,r/Whatcouldgowrong
Tomorrow is T-35 for 1.6Mil shares that Failed to Deliver on 07/26. Tomorrow/this week should be interesting.,18 hours ,139 ,r/Superstonk
Heights of Statues Around the World.,5 hours ,113 ,r/educationalgifs
"Harley is 17, deaf and going blind. I used to always take him to the office with me, but it’s been extremely hard until my neighbor gave me an old jogging stroller. Now Harley gets to go to the office with the other dogs.",15 hours ,17 ,r/HumansBeingBros
No chopsticks for dad? Just use a Barbie doll!,5 hours ,214 ,r/funny
Real life examples of the working memories issues that come with ADHD? Struggling with vocal instructions,10 hours ,910 ,r/adhdmeme
"Rosie, Protector of the house. Devourer of burglars.",5 hours ,333 ,r/Bossfight
That -2 to charisma saving throws is a nice bonus.,1 hour ,1 ,r/dndmemes
"As the countdown approached zero, the astronaut couldn’t keep the fact that every single part of the craft was made by the lowest bidder out of her head.",8 hours ,47 ,r/TwoSentenceHorror
Blursed visit,2 hours ,13 ,r/blursedimages
The Goat is going to wash Yeat,15 hours ,119 ,r/playboicarti
Absolutely adorable,13 hours ,9 ,r/wholesomememes
Factorio's logic...,2 hours ,36 ,r/factorio
😳,8 hours ,67 ,r/perfectlycutscreams
Cats vs Cups. They were doing alright and then Cat #3 came along.,15 hours ,132 ,r/StartledCats
"Tabula circuitu monochromæ | 22-10-17 | by Xponentialdesign | 5 editions • 3tz | As always, thank you for the precious support and please Re-tweet this post to support this dark circuitboard loop 👇",7 hours ,2 ,r/NFT
UK Ape. Held back because I was terrified of the long pilgrimage from HL ISA to IBKR and then to ComputerShire. But I can't tell you how happy I am to have another 80 finally safe and sound at the end of all things...,2 hours ,19 ,r/Superstonk
This level of movement is absolutely INSANE,5 hours ,65 ,r/splatoon
incoming hot pasta,17 hours ,433 ,r/nonononoyes
1 Minute of Beluga Whales Being Intelligent,7 hours ,98 ,r/likeus
I’m not salty. You are.,1 day ,81 ,r/dndmemes
"Which is the best ""squad"" of Reddit's NFT? I chose the Drip Squad.",1 day ,113 ,r/NFT
Morning light in the corner of our NJ living room.,3 hours ,29 ,r/AmateurRoomPorn
"“Untitled”, Me, Mixed Media, 2022",13 hours ,6 ,r/Art
This gets me everytime,5 hours ,49 ,r/IASIP
For real tho,6 hours ,3 ,r/Funnymemes
Trench Life Fishing Pt 2,15 hours ,91 messag,r/distantsocializing
Just pure fun :),2 hours ,15 ,r/rarepuppers
a lot actually 🥰,7 hours ,23 ,r/wholesomememes
This in flight proposal,4 hours ,981 ,r/MadeMeSmile
me_irl,9 hours ,98 ,r/me_irl
Add me - 2797 9294 9255,3 hours ,1 ,r/PokemonGoFriends
"Follow up to the previous post about the 'ask the sexpert'. I did not think that soo many people would ask for the 5 steps so its here, but it is not interesting.",5 hours ,62 ,r/funny
"I dropped my favorite plush under the desk. ""Be more careful,"" I heard from under me as my plush was next to me again",3 hours ,37 ,r/TwoSentenceHorror
Please write in English,3 hours ,478 ,r/facepalm
"The age of the ‘car is king’ is over. The sooner we accept that, the better",3 hours ,765 ,r/Futurology
Russia sharply scales back Far East war games with China,19 hours ,0 ,r/theworldnews
Estonia has banned Russian tourists. Now its lobbying the European Union to do the same,19 hours ,0 ,r/theworldnews
Thoughts on New Interface?,21 hours ,3 ,r/wikipedia
"Flicking the kill switch: governments embrace internet shutdowns as a form of control | From Sudan to Syria, Jordan to Jaipur, the trend towards digital authoritarianism is deepening",23 hours ,0 ,r/theworldnews
Zacian on me - please show online,1 hour ,1 ,r/PokemonGoFriends
Olaf Scholz says EU must reform to cope with enlarging to 30 to 36 members,19 hours ,1 ,r/theworldnews
"Moscow condemns 'Russophobia' in Baltic states, say it will affect ties",3 hours ,0 ,r/theworldnews
"In Spain, farmers in one of the country's poorest regions are plowing up wheat fields and vineyards and planting pistachios, a lucrative, drought-resistant crop.",7 hours ,0 ,r/theworldnews
Ukraine says long-anticipated southern offensive has begun,23 hours ,0 ,r/theworldnews
"Tyranitar On Me, Adding 5",59 minutes ,0 ,r/PokemonGoFriends
"Playing music in childhood linked to a sharper mind in old age, study suggests",3 hours ,0 ,r/theworldnews
Wheat Harvest Rebounds in Canada to Bolster Shaky World Supplies,11 hours ,0 ,r/theworldnews
Whale Shark sucking fish from a net,5 hours ,105 ,r/TheDepthsBelow
‘Artemis generation’: Nasa to launch first crew-rated rocket to moon since 1972 | Nasa,23 hours ,0 ,r/theworldnews
"Environment Agency tells staff to ignore pollution complaints, says ex-employee",19 hours ,0 ,r/theworldnews
"Dolphins form largest alliance network outside humans, study finds",7 hours ,0 ,r/theworldnews
Just a moment...,6 hours ,1 ,r/opensea
Rainy Nights - Paprika_d,6 hours ,35 ,r/PixelArt
Zelenskiy tells Russian forces to flee as Ukraine counteroffensive begins in Kherson,11 hours ,0 ,r/theworldnews
"Berlin, Brussels join calls for ‘fundamental reform’ of EU power market",7 hours ,0 ,r/theworldnews
Mega ampharos 4698 4787 8940,2 hours ,2 ,r/PokemonGoFriends
Georgia prepares to join Single Euro Payments Area,11 hours ,0 ,r/theworldnews
Iraq on verge of civil war: protestors killed as Sadr quits politics,7 hours ,0 ,r/theworldnews
German economy minister says 'bitter reality' is Russia will not resume gas supply,15 hours ,0 ,r/theworldnews
"Over a 1,000 dead in Pakistan flooding, monsoon season 'climate catastrophe'",11 hours ,0 ,r/theworldnews
Maybe Maybe Maybe,18 hours ,7 ,r/ContagiousLaughter
'Zombie ice' from Greenland will raise sea level 10 inches,15 hours ,0 ,r/theworldnews
Two Chinese local banks enter bankruptcy procedures,19 hours ,0 ,r/theworldnews
Beekeeper protecting his bees from being attacked by hornets,4 hours ,2.3k ,r/nextfuckinglevel
"The authorities in Ghana are investigating after a man was mauled to death by a lion after he climbed into a zoo enclosure in the capital, Accra. Wildlife authorities suspect he may have planned to steal two rare white lion cubs which have become a big draw since their birth last November.",15 hours ,0 ,r/theworldnews
‘On a par with the Russians’: rise in Chinese espionage alarms Europe,7 hours ,0 ,r/theworldnews
"Reintroducing bison to grasslands increases plant diversity, drought resilience. Compared to ungrazed areas, reintroducing bison increased native plant species richness by 103% at local scales. Gains in richness continued for 29 y & were resilient to the most extreme drought in 4 decades.",16 hours ,497 ,r/science
Pakistan floods: One third of country is under water - minister - BBC News,15 hours ,0 ,r/theworldnews
Heavily Armed Russian Navy Ships Sailing Between Britain And Ireland,3 hours ,0 ,r/theworldnews
A New Study Confirms That Gravity has Remained Constant for the Entire age of the Universe,11 hours ,0 ,r/theworldnews
Mega Ampharos add me and my friend now 5386 6458 7802. 6570 4836 2113,15 minutes ,2 ,r/PokemonGoFriends
[Greece] Local deputy mayor drags bleeding donkey with pick-up truck,23 hours ,0 ,r/theworldnews
It's not fair,6 hours ,425 ,r/memes
"Zelensky vows to take back Crimea amid Kherson offensive: ""This is ours""",3 hours ,1 ,r/theworldnews
Major sea-level rise caused by melting of Greenland ice cap is ‘now inevitable’,19 hours ,1 ,r/theworldnews
"The #Chiefs are releasing WR Josh Gordon, per source. Gordon has shown great character on the field and in the community since he got to Kansas City and the team is open to him returning. But it’s a numbers game right now and he’s the odd man out.",2 hours ,78 ,r/fantasyfootball
R U READY?,5 hours ,24 ,r/gifsthatendtoosoon
Just pure fun :),2 hours ,16 ,r/rarepuppers
Major sea-level rise caused by melting of Greenland ice cap is ‘now inevitable’,23 hours ,1.2k ,r/science
New Russian combat unit meant to help in Ukraine often drunk: report,7 hours ,1 ,r/theworldnews
"A group of international researchers has uncovered evidence of a super rare genetic condition that gives men an extra X chromosome, reporting the oldest clinical case of Klinefelter Syndrome to date. The evidence comes from a 1,000-year-old skeleton from Portugal.",11 hours ,0 ,r/theworldnews
Bike protest takes over German motorway. The demonstration took place between Frankfurt and Wiesbaden - 40km,19 hours ,0 ,r/theworldnews
"Record-breaking heatwave in Europe will be an average summer by 2035, latest Met Office Hadley Centre data shows",3 hours ,0 ,r/theworldnews
Nordic neighbours attack Norway’s ‘selfish’ plan to curb electricity exports,11 hours ,1 ,r/theworldnews
We Have Ignition: Remarkable Breakthrough in Nuclear Fusion Represents a New Physics Milestone - The Debrief,15 hours ,1 ,r/theworldnews
This in flight proposal,4 hours ,996 ,r/MadeMeSmile
What’s going on with the Greenland ice sheet? It's losing ice faster than forecast and now irreversibly committed to at least 10 inches of sea level rise,15 hours ,0 ,r/theworldnews
"One Month After 50 Ukrainian PoWs Died, Ex-Inmates Detail Abuse at Olenivka Prison",15 hours ,0 ,r/theworldnews
I hit every target in the slingshot minigame in 32 shots,10 hours ,165 ,r/StardewValley
Turkey to five times increase cost of passage through Bosphorus and the Dardanelles,7 hours ,0 ,r/theworldnews
"""Armed Forces of Ukraine break through first line of Russian defence in Kherson Oblast"" – Kakhovka Operational Group",23 hours ,0 ,r/theworldnews
Seen from space: Extreme drought dries up rivers across the globe,15 hours ,0 ,r/theworldnews
𝐋𝐀𝐒𝐓 𝟏 𝐃𝐀𝐘 𝐅𝐎𝐑 𝐌𝐈𝐍𝐓 [𝟓 𝐏𝐄𝐑 𝐖𝐀𝐋𝐋𝐄𝐓] 🎉🔥 NFT,3 hours ,2 ,r/opensea
Resistance in Mariupol lured Russian occupiers into an area littered with Russian mines—the occupiers were blown up,15 hours ,0 ,r/theworldnews
"Germany's Scholz backs Schengen membership for Croatia, Romania, Bulgaria",23 hours ,0 ,r/theworldnews
What is this?,4 hours ,534 ,r/interestingasfuck
"Reintroducing bison to grasslands increases plant diversity, drought resilience. Compared to ungrazed areas, reintroducing bison increased native plant species richness by 103% at local scales. Gains in richness continued for 29 y &amp; were resilient to the most extreme drought in 4 decades.",11 hours ,0 ,r/theworldnews
"A tiny crustacean has near-perfect regenerative abilities, topping those of salamanders like axolotls. Parhyale hawaiensis grows back its limbs with no apparent differences in structure or cellular composition.",11 hours ,0 ,r/theworldnews
Ukraine says it has begun counter-offensive to retake Russian-held south,19 hours ,1 ,r/theworldnews
"DC Comics reduces Latinos to their food in Hispanic Heritage Month covers, fans say",35 minutes ,3 ,r/comicbooks
Taiwan to start shooting down Chinese drones,19 hours ,1 ,r/theworldnews
anime_irl,10 hours ,153 ,r/anime_irl
Youtube: Scientists' work to 'prebunk' millions of users against misinformation,19 hours ,0 ,r/theworldnews
Germany says gas stocks rising quicker than expected,19 hours ,0 ,r/theworldnews
George H. Bush’s letter to Bill Clinton on Inauguration Day in 1993.,17 hours ,853 ,r/Damnthatsinteresting
Iran sends first shipment of drones to Russia for use in Ukraine,11 hours ,0 ,r/theworldnews
Germany was the main producer of ice cream in 2021 in the EU (614 million litres of ice cream) followed by France (459 million litres) and Italy (381 million litres),23 hours ,0 ,r/theworldnews
Nuclear fusion power inches closer to reality,23 hours ,0 ,r/theworldnews
Russian military ridicules Shoigu for ineffective leadership - British intelligence,23 hours ,0 ,r/theworldnews
Meirl,3 hours ,1 ,r/meirl
"German Foreign Minister Annalena Baerbock warned the war in Ukraine “could last years,” telling a newspaper that Berlin is ready to support Kyiv for the long haul.",23 hours ,0 ,r/theworldnews
The traitor ex-MP Kovalyov was eliminated in the Kherson region,15 hours ,0 ,r/theworldnews
"""Ellesse Guy"", Me, Digital, 2022",1 hour ,19 ,r/Art
Gibraltar is officially a city - 180 years late,19 hours ,0 ,r/theworldnews
The Ukrainian flag confiscated from Lithuanian fans at a basketball match in Szombathely,3 hours ,0 ,r/theworldnews
Ukraine war: UN team leaves for Zaporizhzhia nuclear plant,23 hours ,0 ,r/theworldnews
Mega amphros raid now,1 hour ,1 ,r/PokemonGoFriends
Russia's Gazprom to shut down natural gas pipeline to Europe for 3 days,15 hours ,1 ,r/theworldnews
Solar panel sales boom as energy bills soar,23 hours ,0 ,r/theworldnews
Satellite images show holes in the roof of a building at the Ukrainian nuclear power plant Russian troops have been using as a shield,15 hours ,0 ,r/theworldnews
Pakistan pleads for international help as parts of country 'resemble a small ocean',23 hours ,0 ,r/theworldnews
"Russian troops in a new combat unit meant to turn the tide in Ukraine keep getting drunk and harassing locals, nearby residents say",19 hours ,0 ,r/theworldnews
Which teams RB rooms are you avoiding?,15 hours ,458 ,r/fantasyfootball
"Germany's Chancellor Scholz of the Social Democratic Party proposes an end to EU vetoes, starting in areas of foreign policy and taxation.",19 hours ,0 ,r/theworldnews
"Mr. Murder, the murderer that defies all facial recognition...",12 hours ,734 ,r/Bossfight
Ukraine says push against Russian forces near Kherson has begun,19 hours ,0 ,r/theworldnews
Major romantic relationship events affect our psychological well-being much less than one would intuitively assume,1 day ,40 ,r/psychology
Russia says economy will contract by less than 3% in 2022,19 hours ,0 ,r/theworldnews
How to Get My Wikipedia Page to Show Up Im A Campaign Box,13 hours ,1 ,r/wikipedia
"Widenius has three children – My, Max, and Maria – who inspired the names for MySQL, MaxDB and the MySQL-Max distribution, and MariaDB.",5 hours ,2 ,r/wikipedia
Students perceive themselves as a 'math person' or a 'reading person' early on – and this can impact the choices they make throughout their lives,23 hours ,40 ,r/psychology
Four Things We’ve Learned About NASA’s Planned Base Camp on the Moon,9 hours ,94 ,r/Futurology
"""From a Distance"": a religion-themed song by Julie Gold, and popularized by Bette Midler in 1990.",3 hours ,1 ,r/wikipedia
"Study reveals pregnant women are exposed to cancer-causing chemicals in dishware, hair coloring, plastics, and pesticides",5 hours ,116 ,r/science
meirl,19 hours ,248 ,r/meirl
Double Falcon,21 hours ,1 ,r/wikipedia
Just smile and nod,7 hours ,16 ,r/meme
The first private mission to Venus will have just five minutes to hunt for life,23 hours ,110 ,r/Futurology
