Title,Time,Comments,Subreddit
,,,
A random guy sends his vocals to deadmau5 - gets signed immediately and the song became an instant hit,5 hours ,526 ,r/Damnthatsinteresting
What is the craziest thing that's ever happened to you?,14 hours ,7.1k ,r/AskReddit
Woman is reunited with her dog that was missing for two weeks,6 hours ,186 ,r/MadeMeSmile
[OC] saw this guy stealing a mirror in a parking lot and he was packing serious heat,6 hours ,1.3k ,r/pics
WCGW riding recklessly on the inter-state?,14 hours ,3.9k ,r/Whatcouldgowrong
Finish him!,4 hours ,70 ,r/comics
biker helping out a man carrying load on a bridge,6 hours ,180 ,r/HumansBeingBros
This Used Games Store's Bayonetta Box Art,8 hours ,153 ,r/gaming
Tourists in Mexico have a tense encounter with a black bear,8 hours ,2.9k ,r/interestingasfuck
"What should I name this cutie, I’m deleting your comment if you say nemo",19 hours ,3.8k ,r/Aquariums
Blursed_Match,7 hours ,1.1k ,r/blursedimages
"Introverts, you know we had a good time for a bit there",5 hours ,96 ,r/memes
Little Egg Harbor PD (NJ) cops detained a young man in handcuffs because he flipped one of them off. Young man wasn't having any of it!,12 hours ,3.4k ,r/PublicFreakout
I broke a guitar string and it flew into my finger and through the bone,6 hours ,352 ,r/nevertellmetheodds
Amazon is Inhumane,10 hours ,3.3k ,r/antiwork
"If everyone treats you like trash, why don't you just... become trash?",7 hours ,81 ,r/LiveFromNewYork
Alex Jones' 2nd defamation trial over Sandy Hook massacre to move forward,9 hours ,633 ,r/news
"Proud Boy outside of a Drag Brunch in Roanoke, TX",20 hours ,3.2k ,r/texas
"China drought causes Yangtze to dry up, sparking shortage of hydropower",14 hours ,2.5k ,r/news
Kyle likes to go above and beyond.,17 hours ,2.4k ,r/Tinder
Jeff Bezos is one Alexa away from using prison labors.,10 hours ,2.3k ,r/mildlyinfuriating
"Trump demands reinstatement as 'rightful' president or 'a new Election, immediately!' as some Republicans seek distance from him",12 hours ,2.1k ,r/politics
Should Weird Al be in the Rock and Roll Hall of Fame?,20 hours ,2.1k ,r/Music
An attempt to embarrass a climate change activist backfires,9 hours ,2.0k ,r/WatchPeopleDieInside
Fuck long covid,11 hours ,2.0k ,r/AdviceAnimals
"Most legit one I’ve seen yet, $300 on Amazon",17 hours ,1.8k ,r/Justrolledintotheshop
When a BMW tries to imitate an AMG (OC),8 hours ,613 ,r/IdiotsInCars
This speaks for itself,17 hours ,1.7k ,r/iamatotalpieceofshit
Did they really think he'd pay out?,13 hours ,1.7k ,r/LeopardsAteMyFace
Oh I didn't realise we were doing that...someone add me to that WhatsApp group,9 hours ,1.7k ,r/WhitePeopleTwitter
mAyBe mAyBe mAyBe,7 hours ,607 ,r/maybemaybemaybe
German economy minister says 'bitter reality' is Russia will not resume gas supply,14 hours ,1.5k ,r/worldnews
Albert Pujols hits homer #694 and passes Barry Bonds by homering off of 450 different pitchers,8 hours ,719 ,r/baseball
Hey guys did you know that,4 hours ,127 ,r/shitposting
12 years of elderly leisure,6 hours ,204 ,r/antiwork
Caught up in the multiverse of America,17 hours ,1.2k ,r/BlackPeopleTwitter
NN in Florida,14 hours ,1.4k ,r/CrazyFuckingVideos
"Please vote to ban stonetoss, nazism is never acceptable in our community!",14 hours ,126 ,r/dndmemes
Cheese Ball Golf,10 hours ,261 ,r/nextfuckinglevel
"Ok, 343, how long is Co-op getting delayed for?",17 hours ,1.2k ,r/halo
What would you refuse to buy even if you were a millionaire?,8 hours ,4.4k ,r/AskReddit
dunno if this belongs here but sadists will eternally make arguements like these,9 hours ,529 ,r/WorkReform
TIL Matthew McConaughey was first assigned to play Marty Hart in the first season of True Detective. McConaughey asked to switch to Rust Cohle due to the character's obsessive tendencies. McConaughey created a 450-page analysis of Cohle to study the character's evolution in the series.,16 hours ,1.1k ,r/todayilearned
The good ol' tumblr tradition of turning Shitpost into something meaningful.,9 hours ,231 ,r/tumblr
"We've been hit by, we've been struck by a smooth swiminal [IG: kristimakusha]",7 hours ,93 ,r/toptalent
Major sea-level rise caused by melting of Greenland ice cap is ‘now inevitable’,18 hours ,1.1k ,r/science
Went to a friends farm look closely every black dot is a tick,10 hours ,1.2k ,r/Wellthatsucks
"They attacked first, I swear!",6 hours ,79 ,r/AbruptChaos
Kuwaiti woman films maid falling from seventh-floor window instead of trying to help her,16 hours ,1.1k ,r/TerrifyingAsFuck
I always love seeing these pups on my route,9 hours ,170 ,r/rarepuppers
Taking my X-Wing for a casual flight,10 hours ,372 ,r/StarWars
This guy waterslides,11 hours ,535 ,r/oddlysatisfying
Eyes on this.,11 hours ,914 ,r/Superstonk
Don’t put your feet on the seat in front of you then,19 hours ,911 ,r/JusticeServed
"Thanks, I hate it",5 hours ,35 ,r/TIHI
Be careful 👍,18 hours ,946 ,r/IdiotsInCars
For fuck sake Billy,11 hours ,935 ,r/funny
Little Egg Harbor PD (NJ) cops detained a young man in handcuffs because he flipped one of them off. Young man wasn't having any of it!,12 hours ,797 ,r/ThatsInsane
"‘George of the Jungle’: The Right Way to Adapt a Cartoon to Live-Action - Starring Brendan Fraser, 1997's 'George of the Jungle' brought a thirty-year-old animated series to life with humor and charm.",11 hours ,736 ,r/movies
They didn't make Muhammad,7 hours ,712 ,r/CrusaderKings
cursed time machine,8 hours ,398 ,r/cursedcomments
Awwww (๑•ᴗ•๑)♡,9 hours ,58 ,r/wholesomememes
Oh,9 hours ,905 ,r/HolUp
He is strong and wise and I am very proud of him. May the force be with you Ri-Lee.,5 hours ,34 ,r/PrequelMemes
"Legalizing recreational cannabis increases its use, research shows",11 hours ,865 ,r/nottheonion
Little puff loves some scratchies,6 hours ,45 ,r/IllegallySmolCats
Crossing tracks when you can literally see a train,17 hours ,835 ,r/WinStupidPrizes
from one rib to a Mcrib!,11 hours ,461 ,r/PoliticalHumor
Trump Bragged He Had ‘Intelligence’ on Macron’s Sex Life,9 hours ,989 ,r/politics
Big brain moment,8 hours ,94 ,r/dankmemes
Minecraft censoring,9 hours ,811 ,r/Minecraft
FTC Sues ‘Massive’ Data Broker for Selling Location Info on Abortion Clinics,16 hours ,728 ,r/technology
“Sad small dick noises”,9 hours ,342 ,r/technicallythetruth
TIFU By Choosing My Girlfriend Over My Job,16 hours ,692 ,r/tifu
Let's crucify him so he's even more like Jesus!,17 hours ,823 ,r/TheRightCantMeme
Crypto.com accidentally transfers $10.5m to woman instead of $100,9 hours ,818 ,r/CryptoCurrency
"Mr. Murder, the murderer that defies all facial recognition...",7 hours ,370 ,r/Bossfight
"Reintroducing bison to grasslands increases plant diversity, drought resilience. Compared to ungrazed areas, reintroducing bison increased native plant species richness by 103% at local scales. Gains in richness continued for 29 y & were resilient to the most extreme drought in 4 decades.",11 hours ,373 ,r/science
Jake Paul will take on Anderson Silva on Oct 29,6 hours ,770 ,r/ufc
Two British guys at an Australian gun range and shoot for the first time,17 hours ,742 ,r/Firearms
Arctic Monkeys - There’d Better Be A Mirrorball,10 hours ,688 ,r/arcticmonkeys
Hedgies trying weasel their way out using Short GME and Popcorn ETFs by targeting pension and retirement funds we CANNOT let this get suppressed!! We need to bring awareness to this!!! credit to u/polypolipauli for the wrinkles,7 hours ,306 ,r/Superstonk
Chris Rock Says He Was Asked to Host Next Year’s Oscars But Turned It Down,8 hours ,499 ,r/entertainment
When you realize it's not a mirror,10 hours ,139 ,r/Eyebleach
Let’s put Weird Al on the Super Bowl Halftime Show!,10 hours ,432 ,r/Music
To the person who broke into my house last night. I hope you like my dog Rosie.,3 hours ,188 ,r/oddlyterrifying
"Christian school forfeits football game against team with two girls on roster | If coaches refuse to compete in a sport for misogynistic and faith-based reasons, they shouldn’t be rewarded for it. They should be punished for it (Title IX violations) by being kicked out of the conference altogether",19 hours ,690 ,r/atheism
"HR submitted a ticket about hiring candidates not receiving emails, so I investigated. Upon sharing the findings, I got reprimanded for running a message trace...",12 hours ,584 ,r/sysadmin
Standing with those under the Old Covenant,11 hours ,202 ,r/BlackPeopleTwitter
Nadeshot Fires Back at Froste’s Accusations About 100 Thieves,11 hours ,392 ,r/LivestreamFail
There is a column in our local newspaper where you ask questions related to sex.,5 hours ,251 ,r/funny
(Raw Spoiler) Rollins makes things personal,8 hours ,476 ,r/SquaredCircle
from one rib to a Mcrib!,10 hours ,169 ,r/clevercomebacks
People don’t like admitting that they got duped,18 hours ,637 ,r/SelfAwarewolves
Huh?,16 hours ,290 ,r/Gamingcirclejerk
unexpected sex education,9 hours ,284 ,r/whenthe
"[Wojnarowski] New York Knicks guard RJ Barrett is finalizing a four-year rookie extension that could be worth up to $120 million, his agent Bill Duffy of @BDA_Sports + @WME_Sports told ESPN, complicating the franchise’s offseason trade pursuit of Utah Jazz All-Star Donovan Mitchell.",6 hours ,622 ,r/nba
"Man cuts off nose, ears and fingers diabao prado otherwise known as the human satan",9 hours ,789 ,r/Weird
To make Vin Diesel and The Rock look the same size,15 hours ,606 ,r/therewasanattempt
I turned 35 today and have absolutely nothing to show for it. I just need some emotional support.,17 hours ,693 ,r/povertyfinance
I remember it like it was yesterday,4 hours ,19 ,r/KidsAreFuckingStupid
...Guys know that the rise in lonely single men inturn renders more women single too right?,10 hours ,496 ,r/TwoXChromosomes
Younger dogs can actually help older dogs feel youthful again.,5 hours ,64 ,r/FunnyAnimals
"Christopher Reeves has some harsh words for his Superman co-star, legendary actor Marlon Brando, on David Letterman in 1982. We don't get interviews like this anymore.",9 hours ,589 ,r/videos
Trying not to sound southern when leaving a voicemail in Japanese,9 hours ,136 ,r/TikTokCringe
anime_irl,5 hours ,49 ,r/anime_irl
Badass princess right here👇,15 hours ,127 ,r/WitchesVsPatriarchy
Duke volleyball player: BYU slow to act on slurs,18 hours ,504 ,r/sports
Ich🌮iel,3 hours ,53 ,r/ich_iel
"Incoming near miss on Ingulskiy Bridge, Mykolaiv, Ukraine, 30 minutes ago",19 hours ,559 ,r/CombatFootage
Soooo... what're you doing? 🤣,17 hours ,601 ,r/AnimalCrossing
ELI5: why does salt water help in healing mouth ulcers or any oral surgery with tear in gums or cuts inside cheeks,17 hours ,554 ,r/explainlikeimfive
This is arguably the cutest thing I have ever witnessed in Skyrim.,17 hours ,285 ,r/skyrim
This photo just show what we fight for.,12 hours ,514 ,r/ukraine
SBMM has got me absolutely HOOKED on Crucible this season.,9 hours ,593 ,r/DestinyTheGame
Quentin Tarantino (59) has included the N word in every film he has written.,16 hours ,438 ,r/shittymoviedetails
in case u all forgot about the sub’s most talented musician,10 hours ,117 ,r/playboicarti
Cats vs Cups. They were doing alright and then Cat #3 came along.,10 hours ,107 ,r/StartledCats
Warner Bros insiders are reportedly saying that Zack Snyder’s Justice League ‘never should’ve happened’ since it further divided that fanbase against the studio (via @Variety),9 hours ,610 ,r/DC_Cinematic
lmao,14 hours ,198 ,r/formuladank
"Jackson, Mississippi, water system is failing, city to be with no or little drinking water indefinitely",8 hours ,974 ,r/news
My $130 French textbook isn’t even bound,15 hours ,613 ,r/assholedesign
Thoughts?,17 hours ,623 ,r/destiny2
You can't stop change any more than you can't stop the suns from setting,12 hours ,191 ,r/PrequelMemes
Lighthouse by the coast of Iceland.,11 hours ,566 ,r/oddlyterrifying
Nature can be so beautiful sometimes,5 hours ,16 ,r/meme
30TB Portable SSD Hits Walmart For $39 But Stay Away From It,16 hours ,518 ,r/gadgets
oooh get the popcorn ready!,17 hours ,280 ,r/FundieSnarkUncensored
"“Elon, Grimes, how’s the divorce going?…oh.“",13 hours ,213 ,r/CuratedTumblr
Wedding dresses are fucking ugly and they all look the same,11 hours ,483 ,r/unpopularopinion
Netflix,12 hours ,268 ,r/NonPoliticalTwitter
That one is gonna sting…,18 hours ,537 ,r/MurderedByWords
Muslim Father lets daughter drown at Dubai beach rather than have male rescuers ‘touch’ her. Rescuers say girl’s father told them he prefers his daughter dead than being touched by a strange man.,16 hours ,295 ,r/religiousfruitcake
"Despite their prevalence in movies, having eyes that glow must be more of a liability than an advantage.",11 hours ,245 ,r/Showerthoughts
Connor Fell Off +,6 hours ,65 ,r/TrashTaste
The 3 B’s of Dwight!,7 hours ,45 ,r/DunderMifflin
physics is important,12 hours ,574 ,r/yesyesyesyesno
I made a cheerleading-inspired outfit for absolutely no reason,12 hours ,291 ,r/sewing
Civil Candy cane discussions,8 hours ,112 ,r/discordVideos
My brother got married yesterday,16 hours ,278 ,r/CasualUK
As see on,8 hours ,524 ,r/terriblefacebookmemes
Done by Dvantattoos at Rorschach Gallery 2.2 in Green Brook Nj,15 hours ,395 ,r/tattoos
Turns out; they weren't ready,20 hours ,331 ,r/agedlikemilk
Matching butterfly tattoo fail,10 hours ,182 ,r/cringepics
Galan d. [4] Tsitispas 6-0 6-1 3-6 7-5 in the 1st round of the US Open,7 hours ,319 ,r/tennis
"Charlie Day writing Artemis' reveal speech in 'Who Pooped the Bed?""",14 hours ,291 ,r/IASIP
Entire night shift refused to clock in.,15 hours ,371 ,r/nursing
"after all, Science fiction!",17 hours ,465 ,r/marvelmemes
Loving the water.,13 hours ,310 ,r/aww
Alex Pereira (MW) looking reasonably bigger than Dominick Reyes (LHW),13 hours ,385 ,r/MMA
"Why are all male Albinaurics old, skinny dudes with gaping mouths and long beards and sunken eyes, while all female Albinaurics are fair skinned, armored archer babes?",8 hours ,343 ,r/Eldenring
"Jesus drove a Honda, but never spoke of it.",8 hours ,205 ,r/Jokes
"Oops, I thought it was a Yiga…",17 hours ,115 ,r/Breath_of_the_Wild
Red Bull rewarded Honda's Chief Mechanic and Trackside Manager Makoto Yoshino with a trip to the Belgian Grand Prix podium. Photo by Dan Mullan.,17 hours ,198 ,r/formula1
"West Virginia University Researchers have discovered microorganisms alive trapped within 830 million-year-old rocks, and say the discovery may have implications in the search for extraterrestrial life.",21 hours ,440 ,r/Futurology
Last year one of the foster kittens we had maintained eye contact as he took a standing poop,8 hours ,92 ,r/WhatsWrongWithYourCat
"What does society consider ""attractive"" that you absolutely can’t stand?",6 hours ,3.4k ,r/AskReddit
🔥This bird (Penduline Tit) uses a hidden opening to enter its nest while the visible opening leads to an empty pocket to trick snakes,13 hours ,221 ,r/NatureIsFuckingLit
4 vs 1 [DBDL collab],4 hours ,82 ,r/Hololive
"Of all the crazy Gretzky stats, this might be the hardest to wrap my head around",20 hours ,275 ,r/hockey
"Mods don't actually need permission from the community to ban things like meme formats, topics, or actual Nazis",10 hours ,1.0k ,r/dndmemes
I cut open a 10 year old rubber band ball and found that it had fused together,5 hours ,104 ,r/mildlyinteresting
"While driving long road trips, do you ever notice a car who's in front of or behind you for hours that you decide is your road trip buddy? Then tell them goodbye once they or you finally take a separate route?",11 hours ,379 ,r/NoStupidQuestions
What a treasure,8 hours ,107 ,r/MadeMeSmile
Just how much trouble will I be in?,8 hours ,357 ,r/sydney
Meirl,13 hours ,171 ,r/meirl
Derp side of the force (laugh starts at 0:08),11 hours ,125 ,r/ContagiousLaughter
Making of *that* cocaine scene,14 hours ,167 ,r/TheBoys
Art imitates Hollywood,18 hours ,383 ,r/fixedbytheduet
baited,17 hours ,339 ,r/perfectlycutscreams
"Cry harder, Jack.",19 hours ,231 ,r/DarkBRANDON
Tom Scott being heckin based 9 years ago,15 hours ,114 ,r/lgbt
incoming hot pasta,12 hours ,349 ,r/nonononoyes
Nintendo for the W,13 hours ,466 ,r/shitposting
WCGW squatting twice your body weight with shoddy form,5 hours ,215 ,r/Whatcouldgowrong
INTEL and DEATH / 2Fort Walk,10 hours ,183 ,r/tf2
'Star Trek' legend's ashes will head to deep space on a Vulcan rocket,13 hours ,318 ,r/space
HMC while I sit on this broken tree stump.,14 hours ,237 ,r/holdmycosmo
school be like?,13 hours ,246 ,r/adhdmeme
Found a female creep (a rare Pokémon for sure),7 hours ,325 ,r/teenagers
Fox fails again,13 hours ,352 ,r/facepalm
"The 16 plains Bison released into Banff national park, Canada in 2017 have grown into a herd of at least 85.",19 hours ,329 ,r/UpliftingNews
make the comment section the hhm group chat after jimmy copies hamlindigo blue,8 hours ,84 ,r/okbuddychicanery
Me irl,6 hours ,25 ,r/me_irl
West Seattle Starbucks closed briefly due to violent person creating mass damage - hoping we do better for services staff who work these jobs... and find better ways to support & hold accountable those who do this ... hope people show morning crew some love next few days,10 hours ,344 ,r/Seattle
Not picking Ryze is the ultimate litmus test of whether one is capable of self-governance.,12 hours ,319 ,r/leagueoflegends
Boss baby,9 hours ,119 ,r/trashy
"Makes as much or more than Homer, has no mouths to feed, yet lives in poverty. Why?",7 hours ,283 ,r/TheSimpsons
A photo I took in Atlanta,11 hours ,55 ,r/confusing_perspective
"The ""LOSER"" ribbon",18 hours ,239 ,r/MaliciousCompliance
🗿🗿🗿 Cat,11 hours ,110 ,r/AnimalsBeingDerps
Higher caliber go brrr,16 hours ,52 ,r/Invincible
Sesame street lore,9 hours ,35 ,r/SipsTea
"Trixie Vs fundamentalist christians, Girl Defined (from Trixie's 'God Honouring Makeup' reaction video). Things are about to get interesting...",12 hours ,192 ,r/rupaulsdragrace
[OC] 2019 vs 2022 raining,14 hours ,358 ,r/PixelArt
the detail is absolutely wild,5 hours ,102 ,r/ATBGE
does this belong in this sub? apparently being bi-curious isnt a thing anymore,18 hours ,302 ,r/notliketheothergirls
Collei was struggling to write the recipe... my heart,13 hours ,175 ,r/Genshin_Impact
These have been sitting on the shelf for a few months now. It's nice to see that people are finally getting their units.,16 hours ,395 ,r/xboxone
LPT: Wear Earplugs to Concerts.,17 hours ,290 ,r/LifeProTips
Here come the “what aboutisms”,18 hours ,335 ,r/FunnyandSad
Walter White in Mario Kart Wii,13 hours ,171 ,r/breakingbad
"/u/x_v_b explains how the sudden ubiquity of the buzz-phrase ""quiet quitting"" is really just a PR exercise to discourage workers from standing up against wage theft by employers",12 hours ,206 ,r/bestof
It's true and it's not a coincidence,18 hours ,333 ,r/MarchAgainstNazis
"1 month short of not being sunset, Season of dawn weapons, the absolute drip in terms of weapons, will all be missed",17 hours ,379 ,r/DestinyFashion
Pc go burrrrrrr,4 hours ,50 ,r/pcmasterrace
Norway,6 hours ,99 ,r/BeAmazed
Joseph Stalin in 1902.,14 hours ,226 ,r/ColorizedHistory
Sign this petition to add “Question.” as a user flair.,9 hours ,154 ,r/formuladank
hmm,6 hours ,57 ,r/hmm
What was Araki smoking when he came up with this?,13 hours ,83 ,r/ShitPostCrusaders
Splatoon 3's tick rate is only 16hz. The same as Splatoon 2 and 30% slower than Splatoon 1,9 hours ,239 ,r/NintendoSwitch
Peepo,12 hours ,96 ,r/suspiciouslyspecific
yes,11 hours ,43 ,r/HydroHomies
The King has married. Congrats to Jack Gleeson!,14 hours ,179 ,r/freefolk
"Who do you like more, Joe or Mickey",12 hours ,311 ,r/reddeadredemption
True senior.,12 hours ,73 ,r/ProgrammerHumor
"How BIG is Vantage Ult Bullet Size? 100% as big as a TRUCK I might say, looking at this clip!?",8 hours ,370 ,r/apexlegends
Imagine,5 hours ,35 ,r/masseffect
Medb Gets Stiff At Skadi’s New Swimsuit [Syatey],13 hours ,88 ,r/grandorder
He deserved it,19 hours ,317 ,r/instantkarma
Over a Third of Info Shared by GOP Candidates Is Misinformation: Report,8 hours ,217 ,r/politics
Wow…,7 hours ,94 ,r/DiWHY
Hoi4 Modding has Gone to Far!,17 hours ,171 ,r/hoi4
"Employee, who was caught and convicted of stealing $1.4 million from nursing home, fights in court to keep his name secret so it doesn't affect his image at new job.",19 hours ,159 ,r/byebyejob
Rory was all class talking to Scottie's family after winning the TOUR Championship.,18 hours ,225 ,r/golf
You're like an overcooked pasta,10 hours ,30 ,r/rareinsults
"Officer was so infuriated, he was ready to get down on all fours",17 hours ,1.3k ,r/mildlyinfuriating
Yellow Jackets Eating Live Caterpillar,9 hours ,106 ,r/natureismetal
The slow but sure recuperation of the Iberian Lynx,19 hours ,106 ,r/MapPorn
Goddamn Goose Starterpack,16 hours ,287 ,r/starterpacks
"Destiny is incorrect. Nick Fuentes does outwardly meet his definition for ""nazi""",5 hours ,255 ,r/Destiny
First meow😺😺,14 hours ,136 ,r/cats
GGG says Ultimatum is taking years of tunning and balancing while they shove Archnemesis permanently into the game without a second thought,9 hours ,254 ,r/pathofexile
Was about to cut my grass and found this little guy under my lawnmower( luckily before I rode off on it). What all should I buy for him at the pet store to make sure he is well taken care of.,12 hours ,228 ,r/cats
this is my first cooked meal in my new apartment after being homeless for a month!! I’m so happy with how it turned out :D,10 hours ,138 ,r/tonightsdinner
"My vidya is getting criticized, time to make personal attacks!",4 hours ,237 ,r/Gamingcirclejerk
"Experts believe 100's of historic photos of 9/11 will never see the light of day due negative judgement, and backlash their originators might receive from publishing them.",10 hours ,435 ,r/Damnthatsinteresting
can't have shit,12 hours ,125 ,r/ABoringDystopia
"TIFU by taking friends to a taco festival in the UK, it was in a venue with the same EXACT name in Canada",9 hours ,240 ,r/tifu
mAsCoT gEtS dEcApItAtEd DuRiNg sTuNt,16 hours ,135 ,r/PeopleFuckingDying
Cop flashes his badge in hopes I'll serve his underage daughter,7 hours ,146 ,r/TalesFromYourServer
this is probably my favorite parallel in all of fiction,9 hours ,66 ,r/OnePunchMan
I hear the mods like to pin large bets. $750K on $BBBY today. See you in Valhalla.,7 hours ,233 ,r/wallstreetbets
I want the stylist do more things,18 hours ,156 ,r/Terraria
Looks like a Survey Pilot's last day today,13 hours ,618 ,r/funny
"Apartment living room with plaster moldings and a bay window, Berlin, Germany [1440x1800]",8 hours ,44 ,r/RoomPorn
[OC] Number of moves it takes a knight to get around the chessboard,13 hours ,148 ,r/dataisbeautiful
"Drinkwitz on Thursday’s game: “These students up front just asked me about class on Friday. I say skip it. It's early in the year. You can overcome an early deficit.""",8 hours ,205 ,r/CFB
"June Goodman had dinner with her sister, grabbed some chocolate bars, and headed home for the evening on March 28, 2003. She was never seen again. Without even a footprint to hint where she may have gone, investigators say it’s like she “vanished into thin air.” What happened to June Goodman?",10 hours ,164 ,r/UnresolvedMysteries
Jake Paul Vs Anderson Silva Will Fight On October 29th,8 hours ,255 ,r/Boxing
"6,456 days ago, Christmas 2004.",7 hours ,41 ,r/OldPhotosInRealLife
worth the wait,5 hours ,6 ,r/MinecraftMemes
I fed him some lunch,13 hours ,275 ,r/HumansBeingBros
"Santa Cruz surf photographer Dave ""Nelly"" Nelson captures a young sea lion wanting to play fetch with his dog",10 hours ,137 ,r/interestingasfuck
BuT We'VE BeEN tO ThE MoOn,7 hours ,181 ,r/confidentlyincorrect
Brainstorming ideas for my Butcher's shop... too much?,14 hours ,438 ,r/Minecraft
"This show made me realize that I am my brother's ""Chuck"".",6 hours ,184 ,r/betterCallSaul
Me: * Finds Solaris-touched *,12 hours ,254 ,r/pathofexile
ice makers failed to store ice (picture after 2 days of melting),12 hours ,148 ,r/CatastrophicFailure
Westpac online security is a joke: Passwords can only be 6 characters and have no special characters.,7 hours ,282 ,r/AusFinance
A 3D printed Mew my father in law made for me.,6 hours ,26 ,r/pokemon
Grew up to be quite the lass,13 hours ,192 ,r/wholesomememes
"The Murder of Icarus, Me, Digital Art, 2021",10 hours ,91 ,r/Art
"Yes, to celebrate!",8 hours ,128 ,r/PoliticalHumor
"I was reading Turf Wars, and here’s all the character’s reactions to discovering that Korra and Asami are a couple!",13 hours ,107 ,r/legendofkorra
"Well, atleast I tried",8 hours ,304 ,r/teenagers
Cuck of the Night,6 hours ,24 ,r/Animemes
"Traversing ""Thank God Ledge"". One of highlights of the Regular Northwest Face of Half Dome",16 hours ,186 ,r/climbing
I feel like 2 types of people learned Roman Numerals early.,9 hours ,368 ,r/gaming
How my Elden Ring playthrough is going,10 hours ,144 ,r/Eldenring
Cheese!,20 hours ,293 ,r/funnyvideos
Bro was eating those shots,11 hours ,291 ,r/CrazyReality
"[WP] You rush into a church to stop the love of your life from marrying the wrong person. Not paying attention, you shout ""I OBJECT"" only to realize it's a funeral. The deceased immediatelly rises in perfect health. All eyes turn to you.",19 hours ,91 ,r/WritingPrompts
"Google results for ""Bad character design""... (yes, really)",10 hours ,169 ,r/SmashBrosUltimate
"Despite ABSOLUTELY still needing a warranty, this does prove the validity of ""trust me bro"". Well done LTT.",9 hours ,197 ,r/LinusTechTips
🔥 They dropped their phone in the sea and a Beluga whale retrieved it for them 😮,11 hours ,179 ,r/NatureIsFuckingLit
jail Jane ka samay,2 hours ,102 ,r/IndianDankMemes
"“Vote Leave” Brexit propaganda, 2016",15 hours ,146 ,r/PropagandaPosters
3 guys were at a sleep over,8 hours ,89 ,r/Jokes
cursed_axe,8 hours ,35 ,r/cursedcomments
